Course Link,Title,Short Description,Length,Effort,Price,Institution,Subject,Level,Language,Prerequisites,Image Source,Already Enrolled
https://www.edx.org/course/fundamentals-of-java-ee-development,Fundamentals of Java EE Development,Missing,7 Weeks,1-3 hours per week,$99 USD,RedHat,Computer Science,Intermediate,English,Missing,https://www.edx.org/sites/default/files/course/image/featured-card/c_card.jpg,9676
https://www.edx.org/course/produccion-musical-y-su-efecto-en-la-composicion-2,Producción musical y su efecto en la composición,Exploraremos cómo el proceso de producir música interactúa con los elementos de la composición de la música que se está produciendo,6 Weeks,3-5 hours per week,$49 USD,BerkleeX,Music,Introductory,Español,Missing,https://prod-discovery.edx-cdn.org/media/course/image/27f2f5e5-ea79-46b0-87a0-75e2b1a84a24-2fe8242d5453.small.jpg,7373
https://www.edx.org/course/urban-sewage-treatment,Urban Sewage Treatment,Missing,7 Weeks,6-8 hours per week,$50 USD,DelftX,Engineering,Intermediate,English,High school level of mathematics and chemistry is recommended.,https://www.edx.org/sites/default/files/course/image/featured-card/sewage_home_318x210.jpg,39852
https://www.edx.org/course/para-entender-el-bienestar-y-estar-bien,Bienestar para el desarrollo personal y profesional,"Aprende sobre las herramientas y canales que te llevarán a un balance en tu vida, para un mejor desarrollo personal y profesional, logrando conseguir un estado de bienestar integral.",5 Weeks,5-7 hours per week,$29 USD,AnahuacX,Health & Safety,Intermediate,Español,Ninguno,https://prod-discovery.edx-cdn.org/media/course/image/a8fed6eb-5f93-473a-b0bc-e6e9c3ea9e12-59ce87d1a40d.small.jpg,Missing
https://www.edx.org/course/aws-developer-deploying-on-aws,AWS Developer: Deploying on AWS,Missing,6 Weeks,3-4 hours per week,$149 USD,AWS,Computer Science,Advanced,English,Missing,https://prod-discovery.edx-cdn.org/media/course/image/6152449b-250c-45ee-8ed7-53d0670f33c6-9122c32561bf.small.jpg,24658
https://www.edx.org/course/lifestyle-medicine-treatments-of-chronic-disease-p,Lifestyle Medicine Treatments of Chronic Disease – Part 1,"Learn specific lifestyle medicine treatment protocols for a variety of chronic diseases, such as breast cancer, diabetes, and heart disease.",2 Weeks,10-15 hours per week,$179 USD,DoaneX,Medicine,Intermediate,English,HPH-604X (recommended),https://prod-discovery.edx-cdn.org/media/course/image/8731a264-4586-4e11-8750-ae7fcf0dc5c2-fee446ef9959.small.jpg,5090
https://www.edx.org/course/modelos-predictivos-con-machine-learning,Modelos predictivos con Machine Learning,"En este curso conocerás los fundamentos del aprendizaje automático y como crear modelos de predicción, regresión y clasificación con ayuda de Python. Explorarás problemas de clasificación, regresión, series de tiempo, agrupamiento y sistemas expertos.",4 Weeks,6-8 hours per week,$49 USD,AnahuacX,Computer Science,Intermediate,Español,Conocimientos básicos en el lenguaje de programación Python.,https://prod-discovery.edx-cdn.org/media/course/image/37413b1a-5beb-4029-9193-7c8679ced076-9fede08c661e.small.jpeg,Missing
https://www.edx.org/course/digital-transformation-market-and-industry-analysi,Digital Transformation: Market and Industry Analysis,Learn to predict what your future industry or market will lookin a digitally transformed business landscape.,10 Weeks,2-3 hours per week,$129 USD,KTHx,Business & Management,Intermediate,English,"There are no set prerequisites for thiscourse. However, if you're ideally suited, you have at least basic, perhaps advanced knowledge in digital development. You're fairly digital yourself. Most likely you use a smartphone. You are probably a working person, maybe in a management position in an organization. You areat a time and a place where the issues mentionedon this page are heavily debated.",https://prod-discovery.edx-cdn.org/media/course/image/198dd589-3cf5-4d7b-871e-1ef355a271c1-8c103816a561.small.png,7869
https://www.edx.org/course/buscar-en-internet,Buscar en Internet,Aprenderás a planificar una búsqueda desde el comienzo y a utilizar las herramientas que Internet te ofrece para encontrar lo que buscas.,7 Weeks,3-4 hours per week,$49 USD,UPValenciaX,Computer Science,Introductory,Español,Para seguir este curso no necesitas más que conocimientos básicos de navegación por Internet.,https://www.edx.org/sites/default/files/course/image/featured-card/buscar-en-internet_378x225.jpg,26811
https://www.edx.org/course/creating-modern-china-the-republican-period-to-the,Creating Modern China: The Republican Period to the Present,Explore the birth of modern China with a focus on the time between the fall of the Qing and the end of World War II.,15 Weeks,1-3 hours per week,$139 USD,HarvardX,History,Introductory,English,Missing,https://www.edx.org/sites/default/files/course/image/featured-card/sw12.10x-video_still_image11052015-318x210.jpg,42710
https://www.edx.org/course/embedded-systems-shape-the-world-multi-threaded-in,Embedded Systems - Shape The World: Multi-Threaded Interfacing,Missing,8 Weeks,8-10 hours per week,$49 USD,UTAustinX,Computer Science,Intermediate,English,"Computer programming course in any language with exposure to variables, arithmetic, logic, loops, and functions. High school physics course covering current, voltage, resistance, and power. We expect students to have knowledge obtained in part 1 of the course including LED/switch interfacing, I/O port programming, finite state machine, microcontroller debugging, and C programming.",https://www.edx.org/sites/default/files/course/image/featured-card/embedded-systems_shape-the-world_378x225.jpg,27203
https://www.edx.org/course/introduction-to-psychological-research-methods,Introduction to Psychological Research Methods,"Learn how to plan, conduct and analyze psychological research and effectively communicate the results.",7 Weeks,1-2 hours per week,$99 USD,UQx,Humanities,Introductory,English,None,https://www.edx.org/sites/default/files/course/image/featured-card/psyc101.4x_research_318x210.jpg,16733
https://www.edx.org/course/scratch-programming-for-teachers,Scratch: Programming for Teachers,Missing,8 Weeks,3-4 hours per week,$50 USD,DelftX,Computer Science,Introductory,English,Missing,https://prod-discovery.edx-cdn.org/media/course/image/8290b9bd-9edf-44b8-a0db-039a3a357628-f5def02a11c0.small.jpg,7727
https://www.edx.org/course/english-for-journalists-part-2,"English for Journalists, Part 2",Missing,5 Weeks,3-4 hours per week,$49 USD,BerkeleyX,Communication,Intermediate,English,Missing,https://www.edx.org/sites/default/files/course/image/featured-card/hands-1167620_1280_1_1.jpg,22311
https://www.edx.org/course/co-creating-sustainable-cities,Co-Creating Sustainable Cities,Learn how citizen’s co-creation is key in making cities worldwide more sustainable,8 Weeks,6-8 hours per week,$49 USD,"DelftX
WageningenX
DelftWageningenX",Social Sciences,Advanced,English,Bachelors/undergraduate level on: Governance and environmental policy Urban resource management Urban environmental technology,https://prod-discovery.edx-cdn.org/media/course/image/9b9c4077-b3ff-47f2-98b8-7ca9db28b056-21939bd169bd.small.jpg,11997
https://www.edx.org/course/introduction-to-water-and-climate,Introduction to Water and Climate,Missing,10 Weeks,6-8 hours per week,$50 USD,DelftX,Engineering,Intermediate,English,Missing,https://www.edx.org/sites/default/files/course/image/featured-card/citg_ctb3300wcx_edx_2120p.png,35677
https://www.edx.org/course/batteries-fuel-cells-and-their-role-in-modern-so-2,"Batteries, Fuel Cells, and their Role in Modern Society",This course is an introduction to batteries and fuel cells - the cornerstones of electromobility and renewable energy.,6 Weeks,2-4 hours per week,$49 USD,UrFUx,Science,Introductory,English,None,https://prod-discovery.edx-cdn.org/media/course/image/fb3f22b6-2317-4733-8bd0-bc19e5cdba6b-439e230ef383.small.jpg,11465
https://www.edx.org/course/digital-transformation-leadership,Digital Transformation: Leadership,Learn how to handle leadership challenges in a digitally transforming organization and eco-system.,10 Weeks,2-3 hours per week,$129 USD,KTHx,Business & Management,Intermediate,English,"There are no set prerequisites for this course. However, if you're ideally suited, you have at least basic, perhaps advanced knowledge in digital development. You're fairly digital yourself. Most likely you use a smartphone. You are probably a working person, maybe in a management position in an organization. You are at a time and a place where the issues mentionedon this page are heavily debated.",https://prod-discovery.edx-cdn.org/media/course/image/a60649b2-1ad3-4fea-a176-4145bfa4cf06-8751e45c3ebe.small.png,6523
https://www.edx.org/course/introduccion-al-desarrollo-de-videojuegos-con-unit,Introducción al desarrollo de videojuegos con Unity,"Aprende a desarrollar videojuegos multiplataforma utilizando una de las herramientas más populares del mercado, el motor de juegos de Unity.",6 Weeks,3-4 hours per week,$50 USD,UPValenciaX,Computer Science,Intermediate,Español,Casi cualquier alumno con conocimientos básicos de programación puede seguir el curso. Los ejemplos se desarrollaran con C# y una breve introducción al lenguaje formará también parte de los contenidos. Si tienes conocimientos previos básicos en programación no tendrás grandes problemas en seguir el curso.,https://www.edx.org/sites/default/files/course/image/featured-card/uny201x_banner_318x210.jpg,26861
https://www.edx.org/course/what-works-in-education-evidence-based-education-p,What Works in Education: Evidence-Based Education Policies,"Learn what works in education and how to identify, analyze and implement evidence-based education policies that improve learning.",10 Weeks,3-4 hours per week,$25 USD,IDBx,Education & Teacher Training,Introductory,English,Missing,https://prod-discovery.edx-cdn.org/media/course/image/949a4020-22e5-4762-9e15-8be6be00aedf-b4acbd7d8588.small.jpg,5252
https://www.edx.org/course/advanced-algorithmics-and-graph-theory-with-python,Advanced Algorithmics and Graph Theory with Python,"Strengthen your skills in algorithmics and graph theory, and gain experience in programming in Python along the way.",6 Weeks,2-4 hours per week,$49 USD,IMTx,Computer Science,Intermediate,English,Some familiarity with Python 3 and basic mathematics.,https://prod-discovery.edx-cdn.org/media/course/image/4cad72ef-0a40-4eee-bd1b-e3d1834e26eb-531b6c8deb39.small.png,12945
https://www.edx.org/course/social-work-practice-advocating-social-justice-and,Social Work Practice: Advocating Social Justice and Change,Missing,5 Weeks,2-3 hours per week,$49 USD,MichiganX,Social Sciences,Introductory,English,Missing,https://prod-discovery.edx-cdn.org/media/course/image/a214c3e5-ded4-48f9-9f6a-ea5b47af9f18-a6f46b2b4893.small.jpg,19068
https://www.edx.org/course/leading-ambitious-teaching-and-learning,Leading Ambitious Teaching and Learning,Missing,6 Weeks,2-4 hours per week,$199 USD,"MichiganX
microsoftedu",Education & Teacher Training,Advanced,English,Missing,https://prod-discovery.edx-cdn.org/media/course/image/e347cc55-d50e-45f2-b451-28f1df6e168f-23eee929b995.small.jpg,23877
https://www.edx.org/course/aws-iot-developing-and-deploying-an-internet-of-th,AWS IoT: Developing and Deploying an Internet of Things,Missing,4 Weeks,2-5 hours per week,$99 USD,AWS,Computer Science,Intermediate,English,Missing,https://prod-discovery.edx-cdn.org/media/course/image/61d38047-7f6f-4a3a-bacf-43e6d877e8d3-60f951747dab.small.jpg,8303
https://www.edx.org/course/mechanical-behavior-of-materials-part-2-stress-tra,"Mechanical Behavior of Materials, Part 2: Stress Transformations, Beams, Columns, and Cellular Solids",Missing,4 Weeks,11-13 hours per week,$49 USD,MITx,Engineering,Intermediate,English,Missing,https://www.edx.org/sites/default/files/course/image/featured-card/mechanical-behavior-of-materials-378x225.jpg,14131
https://www.edx.org/course/omnichannel-strategy-and-management,Omnichannel Strategy and Management,Understand the needs of omnichannel customers and how to make the transition from a traditional retailer to omnichannel from TuckX and the Tuck School of Business at Dartmouth.,4 Weeks,3-5 hours per week,$99 USD,DartmouthX,Business & Management,Intermediate,English,Basic undergraduate mathematics,https://www.edx.org/sites/default/files/course/image/featured-card/omnichannel-01_318x210.jpg,15496
https://www.edx.org/course/biorefinery-from-biomass-to-building-blocks-of-bio,Biorefinery: From Biomass to Building Blocks of Biobased Products,"Learn how to design an effective biorefinery to obtain valuable components from various biobased feedstocks such as plants, organisms and waste streams.",7 Weeks,12-20 hours per week,$149 USD,WageningenX,Chemistry,Advanced,English,"BSc in technology, engineering (and applied) sciences. You should have at least BSc level knowledge on courses and topics such as chemistry, mathematics and process engineering.",https://prod-discovery.edx-cdn.org/media/course/image/517c325f-4291-4397-bc3e-9e5ce027f4fc-7ec407ca8553.small.jpg,6786
https://www.edx.org/course/que-funciona-en-educacion-politicas-educativas-bas,Qué funciona en educación: políticas educativas basadas en evidencia,"Aprende qué funciona en educación: cómo identificar, analizar e implementar políticas educativas que efectivamente mejoran aprendizajes.",10 Weeks,3-4 hours per week,$25 USD,IDBx,Education & Teacher Training,Introductory,Español,None,https://prod-discovery.edx-cdn.org/media/course/image/bd612f9d-f19a-4661-8bbb-aa599a93089c-9ace51c0f17a.small.jpg,15242
https://www.edx.org/course/research-methods-an-engineering-approach,Research Methods: An Engineering Approach,Learn how to successfully design your research and understand the underlying principles of postgraduate research from an engineering perspective.,8 Weeks,2-3 hours per week,$169 USD,WitsX,Engineering,Introductory,English,"The course is aimed at postgraduate engineering research at the masters and doctoral level. However, the content is accessible without any previous learning.",https://www.edx.org/sites/default/files/course/image/featured-card/edx_banner_elen7070x_005_1.png,20201
https://www.edx.org/course/a-level-mathematics-for-year-13-course-2,"A-level Mathematics for Year 13 - Course 2: General Motion, Moments and Equilibrium, The Normal Distribution, Vectors, Differentiation Methods, Integration Methods and Differential Equations","Develop your thinking skills, fluency and confidence to aim for an A* in A-level maths and prepare for undergraduate STEM degrees.",7 Weeks,2-4 hours per week,$49 USD,ImperialX,Math,Intermediate,English,Missing,https://prod-discovery.edx-cdn.org/media/course/image/6c9b7d4f-592b-4e65-9419-d421a7c75df6-be20b96e80a3.small.jpeg,Missing
https://www.edx.org/course/social-media-how-media-got-social,Social Media: How Media Got Social,"Discover where social media came from, how it became integral to our everyday lives, and how that has changed the way we communicate.",4 Weeks,2-3 hours per week,$139 USD,CurtinX,Communication,Introductory,English,No prerequisites,https://prod-discovery.edx-cdn.org/media/course/image/3dc13ec0-1749-4dc5-9c5a-f63bc8fa3379-78404ecd7086.small.png,13222
https://www.edx.org/course/star-trek-inspiring-culture-and-technology,Star Trek: Inspiring Culture and Technology,Explore the impact and influence of Star Trek on today's society and technology.,7 Weeks,1-3 hours per week,$40 USD,SmithsonianX,History,Introductory,English,None,https://prod-discovery.edx-cdn.org/media/course/image/f5a67dfa-28df-4bc4-bd9e-c34971f76c3f-90f5e7afeb6a.small.jpg,6187
https://www.edx.org/course/hypersonics-from-shock-waves-to-scramjets-2,Hypersonics – from Shock Waves to Scramjets,Understand flight at speeds greater than Mach 5 and discover how to analyse the performance of a scramjet.,4 Weeks,4-8 hours per week,$99 USD,UQx,Engineering,Advanced,English,"This is an open course and anyone can choose to participate and learn about hypersonics. If, however, you want to delve into the field deeply, it is recommended that you have a good understanding of introductory concepts in Calculus, Fluid Mechanics and Thermodynamics. These will enable you to fully participate in the course, particularly the assessment tasks. The following online courses could be useful for you to access before you start to get yourself up to speed:",https://www.edx.org/sites/default/files/course/image/featured-card/1hypers301x_course_homepage378x225.jpg,18745
https://www.edx.org/course/general-overview-of-cannabis-and-the-industrys-out,General Overview of Cannabis and the Industry’s Outlook and Professions,An in-depth view of cannabis and its potential uses.,4 Weeks,5-10 hours per week,$199 USD,DoaneX,Environmental Studies,Introductory,English,Missing,https://prod-discovery.edx-cdn.org/media/course/image/ef8093bb-7431-4f54-b2b9-34732a6a615d-ace5f03fb917.small.jpeg,Missing
https://www.edx.org/course/electric-cars-business,Electric Cars: Business,Missing,4 Weeks,4-5 hours per week,$50 USD,DelftX,Business & Management,Intermediate,English,Missing,https://prod-discovery.edx-cdn.org/media/course/image/5ceeb83e-4eea-44cc-ad10-3518bf343394-df8020c1f2c7.small.png,13855
https://www.edx.org/course/aprende-griego-clasico-2,"Introducción al griego clásico: verbos, oraciones y filosofía","Continua tu periplo aprendiendo lo esencial del sistema verbal del griego clásico y de su sintaxis de la mano de contenidos culturales relacionados con la filosofía, la política y el amor en la Antigüedad.",5 Weeks,4-5 hours per week,$49 USD,UAMx,Language,Introductory,Español,"Se recomienda haber cursado la primera parte del programa, ""Introducción al griego clásico: lengua, nombres y mitología"".",https://prod-discovery.edx-cdn.org/media/course/image/6939ccf0-a699-446f-8a25-5e9d440a8c85-9516f697008c.small.jpg,Missing
https://www.edx.org/course/fintech-ethics-and-risks,FinTech Ethics and Risks,"Learn how individuals and organizations can utilize and regulate blockchain, AI, and other FinTech solutions to ensure their adoption does not come at the expense of societal growth.",6 Weeks,1-5 hours per week,$199 USD,HKUx,Economics & Finance,Introductory,English,Missing,https://prod-discovery.edx-cdn.org/media/course/image/b72fc2e6-963f-4ec6-be14-0dab8807fc66-566c4faf668d.small.jpg,10255
https://www.edx.org/course/quantum-mechanics-and-quantum-computation,Quantum Mechanics and Quantum Computation,A simple conceptual introduction to quantum mechanics and quantum computation.,10 Weeks,5-12 hours per week,$49 USD,BerkeleyX,Computer Science,Intermediate,English,"A strong background in basic linear algebra, including vectors, matrices, complex numbers, inner products, eigenvalues and eigenvectors (a simple diagnostic quiz will help you assess your background). Mathematical maturity and familiarity with ideas of computer science such as big-Oh notation, algorithms and how to bound the running time of an elementary algorithm.",https://www.edx.org/sites/default/files/course/image/featured-card/quantum_cs-191x_378x225.jpg,42042
https://www.edx.org/course/globalization-past-and-future,Globalization: Past and Future,Is globalization a new phenomenon or a cyclical pattern throughout human history?,4 Weeks,2-4 hours per week,$25 USD,SDGAcademyX,History,Introductory,English,None,https://prod-discovery.edx-cdn.org/media/course/image/f21c583c-786d-4ace-b63e-270fe2cb3e6d-e2fd7fc94a4e.small.jpg,9551
https://www.edx.org/course/competencias-profesionales-genericas-para-la-inclu,"Competencias para buscar, mantener y promocionar en un empleo","Mejora tu capacitación laboral a través del aprendizaje de competencias comunicativas, sociales y emocionales con este curso accesible e inclusivo.",4 Weeks,3-5 hours per week,$49 USD,UAMx,Social Sciences,Introductory,Español,Missing,https://prod-discovery.edx-cdn.org/media/course/image/48596080-2b61-41be-90e2-15521eb86ea1-8feba4f4147a.small.jpeg,Missing
https://www.edx.org/course/drainage-in-agriculture-controlling-water-and-sa-2,Drainage in Agriculture: controlling water and salt levels in the soil,Get prepared for heavier rainfall and the increasing demand for food! The #1 Agricultural University of the world will teach you how to design and implement effective drainage systems in agriculture. You will learn how to create a perfect soil profile for optimal growing conditions for a crop and help feed the growing world population. Enrol now and prepare for the effects of climate change by draining excess water.,5 Weeks,18-20 hours per week,$49 USD,WageningenX,Environmental Studies,Advanced,English,"Preferable Bachelor degree in agricultural water management or a similar programme. It is assumed that you have some basic knowledge on soil chemical, physical and biological processes, hydrology, hydraulics, irrigation and agricultural water management.",https://prod-discovery.edx-cdn.org/media/course/image/20654e2f-23ef-4737-958c-9c16e75ecc24-e35e6e98a4db.small.jpg,Missing
https://www.edx.org/course/global-media-war-and-technology,"Global Media, War, and Technology","Explore the intersection of information technology, violent conflict, and resistance.",7 Weeks,2-4 hours per week,$99 USD,UQx,Humanities,Introductory,English,None,https://www.edx.org/sites/default/files/course/image/featured-card/mediawarx-banner-318x210.jpg,12304
https://www.edx.org/course/genetic-models-for-animal-breeding-2,Genetic Models for Animal Breeding,Understand the genetic and statistic principles that enable responsible animal breeding and set-up and improve your own breedingprogram.,6 Weeks,4-6 hours per week,$99 USD,WageningenX,Biology & Life Sciences,Intermediate,English,High school level mathematics and genetics University level Basic Statistics,https://prod-discovery.edx-cdn.org/media/course/image/83fe6f4d-2509-4d94-a10a-649882b582d5-6a21af3ef4d4.small.jpg,10994
https://www.edx.org/course/quality-of-life-livability-in-future-cities,Quality of Life: Livability in Future Cities,"Learn how urban planning, energy, climate, ecology and mobility impact the livability and quality of life of a “future city.”",11 Weeks,2-3 hours per week,$169 USD,ETHx,Architecture,Introductory,English,None,https://www.edx.org/sites/default/files/course/image/featured-card/fc-02x-livable_cities-378x225.jpg,33057
https://www.edx.org/course/fundamentos-de-mecanica-para-ingenieria,Fundamentos de Mecánica para Ingeniería,"Estudiaremos la cinemática y la dinámica del punto, los conceptos de trabajo y potencia y la energía mecánica.",6 Weeks,3-4 hours per week,"₹3,666",UPValenciaX,Physics,Introductory,Español,Para seguir este curso se requieren un nivel de matemáticas similar al que se imparte en Bachillerato,https://www.edx.org/sites/default/files/course/image/featured-card/fundamentos-de-mecanica-para-ingenieria_378x225.jpg,13684
https://www.edx.org/course/mathtrackx-integral-calculus,MathTrackX: Integral Calculus,Discover concepts and techniques relating to integration and how they can be applied to solve real world problems.,4 Weeks,3-6 hours per week,$79 USD,AdelaideX,Math,Introductory,English,Missing,https://prod-discovery.edx-cdn.org/media/course/image/c6097542-da7f-4b5e-a141-9ac817e513ad-665d4fb3cc85.small.jpeg,Missing
https://www.edx.org/course/biobased-products-for-a-sustainable-bioeconomy,Biobased Products for a Sustainable (Bio)economy,Discover how fossil fuels are being replaced by renewable resources to create sustainable and biobased products.,10 Weeks,5-6 hours per week,$50 USD,"DelftXRWTHx
DelftX
RWTHx",Biology & Life Sciences,Introductory,English,Basic knowledge of a natural science like biology,https://prod-discovery.edx-cdn.org/media/course/image/addc788a-fa12-439b-877e-ac508365bfdf-11ba2a4695a1.small.jpg,6492
https://www.edx.org/course/first-nights-berliozs-symphonie-fantastique-and-pr,First Nights - Berlioz’s Symphonie Fantastique and Program Music in the 19th Century,"Learn about Hector Berlioz's Symphonie Fantastique, an iconic Romantic symphony that ushered in an era of narrative ""program music.""",3 Weeks,3-5 hours per week,$49 USD,HarvardX,Humanities,Introductory,English,Missing,https://www.edx.org/sites/default/files/course/image/featured-card/mus_harvardx_318x210.jpg,7969
https://www.edx.org/course/designing-and-leading-learning-systems,Designing and Leading Learning Systems,"Learn leading strategies for educational innovation to improve practice, raise student performance, and reduce achievement gaps.",8 Weeks,2-4 hours per week,$199 USD,MichiganX,Education & Teacher Training,Advanced,English,"Working knowledge of schools and education systems as well as the political, policy, and public pressures to improve educational opportunities and outcomes for all students.",https://prod-discovery.edx-cdn.org/media/course/image/d7cdb19c-2983-4a5a-8c18-49715a85d755-80a0e6304f2d.small.jpg,11680
https://www.edx.org/course/enabling-technologies-for-data-science-and-analyti,Enabling Technologies for Data Science and Analytics: The Internet of Things,Discover the relationship between Big Data and the Internet of Things (IoT).,5 Weeks,7-10 hours per week,$99 USD,ColumbiaX,Computer Science,Introductory,English,Missing,https://prod-discovery.edx-cdn.org/media/course/image/a58d02d2-ee6b-4903-8075-15d516b28254-a14c08150405.small.jpg,70992
https://www.edx.org/course/global-business-strategy,Global Business Strategy,"Learn how to capitalize on opportunities, and manage the challenges of the global marketplace, and leverage this dynamic environment for long-term value.",7 Weeks,8-10 hours per week,$215 USD,"UMD
USMx",Business & Management,Advanced,English,Missing,https://prod-discovery.edx-cdn.org/media/course/image/e435bd5b-8843-40c8-b260-ce34433d9a0e-a3897f869072.small.jpg,7157
