Course Link,Title,Short Description,Length,Effort,Price,Institution,Subject,Level,Language,Prerequisites,Image Source,Already Enrolled
https://www.edx.org/course/cs50s-introduction-to-computer-science,CS50's Introduction to Computer Science,An introduction to the intellectual enterprises of computer science and the art of programming.,12 Weeks,6-18 hours per week,$90 USD,HarvardX,Computer Science,Introductory,English,None.,https://www.edx.org/sites/default/files/course/image/featured-card/cs50.jpg,2305618
https://www.edx.org/course/cs50s-web-programming-with-python-and-javascript,CS50's Web Programming with Python and JavaScript,"This course picks up where CS50 leaves off, diving more deeply into the design and implementation of web apps with Python, JavaScript, and SQL using frameworks like Django, React, and Bootstrap.",12 Weeks,6-9 hours per week,$90 USD,HarvardX,Computer Science,Intermediate,English,CS50 or prior programming experience in any language.,https://prod-discovery.edx-cdn.org/media/course/image/8f8e5124-1dab-47e6-8fa6-3fbdc0738f0a-762af069070e.small.jpg,642502
https://www.edx.org/course/entrepreneurship-in-emerging-economies,Entrepreneurship in Emerging Economies,Explore how entrepreneurship and innovation tackle complex social problems in emerging economies.,6 Weeks,3-5 hours per week,$125 USD,HarvardX,Business & Management,Introductory,English,None,https://prod-discovery.edx-cdn.org/media/course/image/387c5b5b-ef7f-43b9-b9b5-4163f3c74a49-c7a02a264e7c.small.jpg,556259
https://www.edx.org/course/cs50s-introduction-to-game-development,CS50's Introduction to Game Development,Missing,12 Weeks,6-9 hours per week,$149 USD,HarvardX,Computer Science,Intermediate,English,Missing,https://prod-discovery.edx-cdn.org/media/course/image/8d1da557-03db-4175-b881-e0480d706d96-d4fc70850897.small.jpg,325965
https://www.edx.org/course/rhetoric-art-of-persuasive-writing-public-speaking,Rhetoric: The Art of Persuasive Writing and Public Speaking,Gain critical communication skills in writing and public speaking with this introduction to American political rhetoric.,8 Weeks,2-3 hours per week,$99 USD,HarvardX,Humanities,Introductory,English,Missing,https://prod-discovery.edx-cdn.org/media/course/image/941c1967-d0ee-49bc-b3c5-e6ccf4681f2a-14ac60434ff5.small.jpeg,294479
https://www.edx.org/course/cs50s-introduction-to-artificial-intelligence-with-python,CS50's Introduction to Artificial Intelligence with Python,Learn to use machine learning in Python in this introductory course on artificial intelligence.,7 Weeks,10-30 hours per week,$199 USD,HarvardX,Computer Science,Introductory,English,CS50 or prior programming experience in Python.,https://prod-discovery.edx-cdn.org/media/course/image/3a31db71-de8f-45f1-ae65-11981ed9d680-31634d40b3bb.small.png,219045
https://www.edx.org/course/fundamentals-of-neuroscience-part-1-the-electrical,"Fundamentals of Neuroscience, Part 1: The Electrical Properties of the Neuron",Learn how electricity makes the neurons in your brain tick.,5 Weeks,3-5 hours per week,$99 USD,HarvardX,Biology & Life Sciences,Introductory,English,"Some familiarity witharithmetic, basic algebra, and working with equations.",https://prod-discovery.edx-cdn.org/media/course/image/f8042b37-6a21-4afa-b9e2-6f51dcd694db-11fbc288a095.small.png,362182
https://www.edx.org/course/contract-law-from-trust-to-promise-to-contract,Contract Law: From Trust to Promise to Contract,"Contracts are a part of our everyday life, arising in collaboration, trust, promise and credit. How are contracts formed? What makes a contract enforceable? What happens when one party breaks a promise?",8 Weeks,3-6 hours per week,$125 USD,HarvardX,Business & Management,Intermediate,English,None.,https://www.edx.org/sites/default/files/course/image/featured-card/contractsx_from_trust_to-promise_to_contract_378x225_0.jpg,400523
https://www.edx.org/course/data-science-r-basics,Data Science: R Basics,"Build a foundation in R and learn how to wrangle, analyze, and visualize data.",8 Weeks,1-2 hours per week,$49 USD,HarvardX,Data Analysis & Statistics,Introductory,English,An up-to-date browser is recommended to enable programming directly in a browser-based interface.,https://prod-discovery.edx-cdn.org/media/course/image/91f52ef3-fa3f-4934-9d19-8d5a32635cd4-d99e27f09d19.small.jpg,493537
https://www.edx.org/course/data-science-machine-learning,Data Science: Machine Learning,Build a movie recommendation system and learn the science behind one of the most popular and successful data science techniques.,8 Weeks,2-4 hours per week,$49 USD,HarvardX,Data Analysis & Statistics,Introductory,English,This course is part of our Professional Certificate Program in Data Science and we recommend the preceding courses in the series as prerequisites.,https://prod-discovery.edx-cdn.org/media/course/image/7e5958e8-d709-41ab-8f8c-4339f7a733c9-bbb3b4ab9455.small.jpg,258162
https://www.edx.org/course/justice-2,Justice,This introduction to moral and political philosophy is one of the most popular courses taught at Harvard College.,12 Weeks,3-6 hours per week,$99 USD,HarvardX,Humanities,Introductory,English,Missing,https://www.edx.org/sites/default/files/course/image/featured-card/er22x_378x225_0.jpg,374219
https://www.edx.org/course/child-protection-childrens-rights-in-theory-and-pr,Child Protection: Children's Rights in Theory and Practice,"Learn how to protect children from violence, exploitation, and neglect through law, policy, and practice in a human rights framework.",16 Weeks,2-6 hours per week,$99 USD,HarvardX,Social Sciences,Introductory,English,Missing,https://prod-discovery.edx-cdn.org/media/course/image/9c1d402e-ed9e-49e3-874b-dd86d5500408-f33c93f671fd.small.jpg,203139
https://www.edx.org/course/ielts-academic-test-preparation,IELTS Academic Test Preparation,"Prepare for the IELTS Academic tests in this comprehensive, self-paced course covering listening, speaking, reading and writing.",8 Weeks,5-10 hours per week,$99 USD,UQx,Communication,Introductory,English,None. This course is suitable for anyone preparing to take the Academic IELTS test.,https://www.edx.org/sites/default/files/course/image/featured-card/ielts101x-318x210.jpg,1058610
https://www.edx.org/course/programming-for-everybody-getting-started-with-pyt,Programming for Everybody (Getting Started with Python),"This course is a ""no prerequisite"" introduction to Python Programming. You will learn about variables, conditional execution, repeated execution and how we use functions. The homework is done in a web browser so you can do all of the programming assignments on a phone or public computer.",7 Weeks,2-4 hours per week,$49 USD,MichiganX,Computer Science,Introductory,English,Missing,https://prod-discovery.edx-cdn.org/media/course/image/911175d0-6724-4276-a058-c7b052773dd1-aba3108f3ab9.small.png,265266
https://www.edx.org/course/principles-of-biochemistry,Principles of Biochemistry,"This introduction to biochemistry explores the molecules of life, starting at simple building blocks and culminating in complex metabolism.",15 Weeks,4-6 hours per week,$199 USD,HarvardX,Medicine,Intermediate,English,"College-level Introductory Biology
College-level Introductory General Chemistry, including basic Organic Chemistry",https://www.edx.org/sites/default/files/course/image/featured-card/principles_of_biochem-378x225_0.jpg,248524
https://www.edx.org/course/using-python-for-research,Using Python for Research,Take your introductory knowledge of Python programming to the next level and learn how to use Python 3 for your research.,12 Weeks,2-4 hours per week,$99 USD,HarvardX,Computer Science,Intermediate,English,Some previous Python programming experience (in any version of Python),https://www.edx.org/sites/default/files/course/image/featured-card/copy_of_courseimage_ph526x_usingpythonforresearch_318x210.jpg,255056
https://www.edx.org/course/the-architectural-imagination,The Architectural Imagination,Learn fundamental principles of architecture — as an academic subject or a professional career — by studying some of history’s most important buildings.,10 Weeks,3-5 hours per week,$99 USD,HarvardX,Architecture,Introductory,English,None,https://www.edx.org/sites/default/files/course/image/featured-card/hx_archimagx_coursethumbnail_318x210.jpg,393795
https://www.edx.org/course/toefl-test-preparation-the-insiders-guide,TOEFL® Test Preparation: The Insider’s Guide,Prepare for the TOEFL® test and learn how to improve your score and English language skills from the experts who create the exam.,6 Weeks,2-4 hours per week,$49 USD,ETSx,Communication,Introductory,English,None,https://prod-discovery.edx-cdn.org/media/course/image/ee4f4f12-e6ec-45ac-94df-b90b4b022903-aaf6257f767b.small.jpeg,982514
https://www.edx.org/course/science-cooking-from-haute-cuisine-to-soft-matter,Science & Cooking: From Haute Cuisine to Soft Matter Science (chemistry),"Top chefs and Harvard researchers explore how everyday cooking and haute cuisine can illuminate basic principles in chemistry, physics, and engineering. Learn about food molecules and how chemical reactions can affect food texture and flavor.",16 Weeks,2-3 hours per week,$99 USD,HarvardX,Chemistry,Introductory,English,"Basic mathematics concepts (arithmetic, algebra, geometry)",https://www.edx.org/sites/default/files/course/image/featured-card/cooking_course_378x225_0_0.jpg,138495
https://www.edx.org/course/how-to-learn-online,How to Learn Online,Learn essential strategies for successful online learning,2 Weeks,2-3 hours per week,$49 USD,edX,Education & Teacher Training,Introductory,English,None,https://prod-discovery.edx-cdn.org/media/course/image/0e575a39-da1e-4e33-bb3b-e96cc6ffc58e-8372a9a276c1.small.png,105053
https://www.edx.org/course/basic-spanish-1-getting-started,Basic Spanish 1: Getting Started,"Learn Spanish and explore Spanish culture in this introductory language course, designed for English speakers.",7 Weeks,4-5 hours per week,$40 USD,UPValenciaX,Communication,Introductory,English,None,https://www.edx.org/sites/default/files/course/image/featured-card/bsp101x-learn_spanish-basic_spanish_for_english_speakers-378x225.jpg,383075
https://www.edx.org/course/hinduism-through-its-scriptures,Hinduism Through Its Scriptures,"Learn about the rich diversity of Hindu sacred texts – hymns, narratives, philosophical thought – and their interpretations.",4 Weeks,5-10 hours per week,$49 USD,HarvardX,Humanities,Introductory,English,None,https://www.edx.org/sites/default/files/course/image/featured-card/hds_3221.1x_religious_lit_318x210.jpg,137618
https://www.edx.org/course/python-basics-for-data-science,Python Basics for Data Science,"This Python course provides a beginner-friendly introduction to Python for Data Science. Practice through lab exercises, and you'll be ready to create your first Python scripts on your own!",1 Weeks,2-5 hours per week,$39 USD,IBM,Data Analysis & Statistics,Introductory,English,Basic Math,https://prod-discovery.edx-cdn.org/media/course/image/381a0046-5d78-4790-8776-74620d59f48e-cbb3a5d5a4dd.small.png,209843
https://www.edx.org/course/statistics-and-r,Statistics and R,An introduction to basic statistical concepts and R programming skills necessary for analyzing data in the life sciences.,4 Weeks,2-4 hours per week,$249 USD,HarvardX,Data Analysis & Statistics,Intermediate,English,Missing,https://www.edx.org/sites/default/files/course/image/featured-card/statistics-and-r-for-the-life-sciences_378x225_6.jpg,307587
https://www.edx.org/course/introduction-to-data-analysis-using-excel-2,Introduction to Data Analysis using Excel,"Learn the basics of Excel, one of the most popular data analysis tools, to help visualize and gain insights from your data.",4 Weeks,2-4 hours per week,$99 USD,Microsoft,Data Analysis & Statistics,Introductory,English,Missing,https://www.edx.org/sites/default/files/course/image/featured-card/dat205x_banner_318x210.jpg,618587
https://www.edx.org/course/the-health-effects-of-climate-change,The Health Effects of Climate Change,"Learnhow global warming impacts human health, and the wayswe can diminish those impacts.",7 Weeks,3-5 hours per week,$99 USD,HarvardX,Environmental Studies,Introductory,English,None,https://prod-discovery.edx-cdn.org/media/course/image/ac3a7ef0-00e1-454b-aa69-abded71c6129-c8f266d9a432.small.jpg,104824
https://www.edx.org/course/pyramids-of-giza-ancient-egyptian-art-and-archaeol,Pyramids of Giza: Ancient Egyptian Art and Archaeology,"Explore the archaeology, history, art, and hieroglyphs surrounding the famous Egyptian Pyramids at Giza. Learn about Old Kingdom pharaohs and elites, tombs, temples, the Sphinx, and how new technology is unlocking their secrets.",8 Weeks,2-4 hours per week,$99 USD,HarvardX,Art & Culture,Introductory,English,None. This is an introductory course.,https://prod-discovery.edx-cdn.org/media/course/image/d32bba34-f516-4116-bf61-9c6b124c3e3c-021bf104cfdd.small.jpg,117586
https://www.edx.org/course/lessons-from-ebola-preventing-the-next-pandemic,Lessons from Ebola: Preventing the Next Pandemic,"Understanding the context for the Ebola outbreak: What went right, what went wrong, and how we can all do better.",4 Weeks,3-5 hours per week,$49 USD,HarvardX,Social Sciences,Introductory,English,None,https://www.edx.org/sites/default/files/course/image/featured-card/ph557x-about_page_image-352x210.jpg,88431
https://www.edx.org/course/data-science-visualization,Data Science: Visualization,Learn basic data visualization principles and how to apply them using ggplot2.,8 Weeks,1-2 hours per week,$49 USD,HarvardX,Data Analysis & Statistics,Introductory,English,An up-to-date browser is recommended to enable programming directly in a browser-based interface.,https://prod-discovery.edx-cdn.org/media/course/image/b4072f23-f746-43a1-9819-8e3d8b066f38-76465b3bdbcc.small.jpg,161876
https://www.edx.org/course/excel-fundamentos-y-herramientas,Excel: Fundamentos y herramientas,"En este curso aprenderás las herramientas más habituales de Microsoft Excel, desde lo más básico a los gráficos, funciones y tablas de datos.",8 Weeks,3-4 hours per week,$50 USD,UPValenciaX,Computer Science,Introductory,Español,Para este curso solo hacen falta conocimientos aritméticos básicos.,https://www.edx.org/sites/default/files/course/image/featured-card/excel_378x225.jpg,266829
https://www.edx.org/course/omens-oracles-prophecies,"PredictionX: Omens, Oracles & Prophecies","This course is an overview of divination systems, ranging from ancient Chinese bone burning to modern astrology.",1 Weeks,3-5 hours per week,$25 USD,HarvardX,Social Sciences,Introductory,English,None,https://prod-discovery.edx-cdn.org/media/course/image/2c9ed992-c007-4182-a9f4-7524b2029082-db78cc614b72.small.jpg,85081
https://www.edx.org/course/cs50-for-lawyers,CS50 for Lawyers,Missing,10 Weeks,3-6 hours per week,$99 USD,HarvardX,Computer Science,Introductory,English,Missing,https://prod-discovery.edx-cdn.org/media/course/image/315ce06a-d9f7-4c7e-ac11-1fe99e20893e-ff14684c60b3.small.png,83087
https://www.edx.org/course/improving-global-health-focusing-on-quality-and-sa,Improving Global Health: Focusing on Quality and Safety,An introduction to the emerging field of global healthcare quality.,10 Weeks,2-4 hours per week,$99 USD,HarvardX,Social Sciences,Intermediate,English,Missing,https://prod-discovery.edx-cdn.org/media/course/image/2f5692de-8f38-466c-b4fa-3e8fe42df639-7fa225befd20.small.jpg,124389
https://www.edx.org/course/christianity-through-its-scriptures,Christianity Through Its Scriptures,"Learn about Christianity through a study of its sacred scriptures. We will explore how diverse Christians have interpreted these writings and practiced their teachings over a 2000 year, global history.",4 Weeks,5-10 hours per week,$49 USD,HarvardX,Humanities,Introductory,English,Missing,https://www.edx.org/sites/default/files/course/image/featured-card/hds_3221.1x_religious_lit_318x210.jpg,122091
https://www.edx.org/course/introduction-to-data-wise-a-collaborative-process,Introduction to Data Wise: A Collaborative Process to Improve Learning & Teaching,Missing,10 Weeks,1-2 hours per week,$70 USD,HarvardX,Education & Teacher Training,Intermediate,English,Missing,https://www.edx.org/sites/default/files/course/image/featured-card/intro-to-datawise-378x225.jpg,115722
https://www.edx.org/course/leaders-of-learning,Leaders of Learning,Explore and understand your own theories of learning and leadership. Gain the tools to imagine and build the future of learning.,10 Weeks,2-4 hours per week,$99 USD,HarvardX,Communication,Introductory,English,None,https://www.edx.org/sites/default/files/course/image/featured-card/gse2x-video_still_image11132015-318x210.jpg,223565
https://www.edx.org/course/english-grammar-and-style,English Grammar and Style,Learn key concepts and strategies in grammar and style to help enhance your writing and confidently respond to the demand of high levels of literacy in the 21st century.,8 Weeks,3-4 hours per week,$99 USD,UQx,Humanities,Introductory,English,Missing,https://www.edx.org/sites/default/files/course/image/featured-card/write101x-318x210.jpg,653694
https://www.edx.org/course/data-science-probability,Data Science: Probability,Learn probability theory -- essential for a data scientist -- using a case study on the financial crisis of 2007-2008.,8 Weeks,1-2 hours per week,$49 USD,HarvardX,Data Analysis & Statistics,Introductory,English,Missing,https://prod-discovery.edx-cdn.org/media/course/image/54a056bd-bfd5-45a2-ba71-aad017e1d275-a2fbb913691a.small.jpg,128575
https://www.edx.org/course/the-science-of-happiness-3,The Science of Happiness,"The first MOOC to teach positive psychology. Learn science-based principles and practices for a happy, meaningful life.",11 Weeks,4-5 hours per week,$139 USD,BerkeleyX,Social Sciences,Introductory,English,None.,https://www.edx.org/sites/default/files/course/image/featured-card/gg101x_course_banner378x225.jpg,468792
https://www.edx.org/course/prescription-drug-regulation-cost-and-access-curre,"Prescription Drug Regulation, Cost, and Access: Current Controversies in Context","Understand how the FDA regulates pharmaceuticals and explore debates on prescription drug costs, marketing, and testing.",8 Weeks,2-5 hours per week,$99 USD,HarvardX,Medicine,Introductory,English,None,https://prod-discovery.edx-cdn.org/media/course/image/63b7029d-0eb4-40ba-8140-2f9781915ca4-de783ac6c899.small.jpg,76787
https://www.edx.org/course/analyzing-and-visualizing-data-with-excel-2,Analyzing and Visualizing Data with Excel,"Develop your skills with Excel, one of the common tools that data scientists depend on to gather, transform, analyze, and visualize data.",6 Weeks,2-4 hours per week,$99 USD,Microsoft,Business & Management,Intermediate,English,"Understanding of Excel analytic tools such as tables, pivot tables and pivot charts. Also, some experience in working with data from databases and also from text files will be helpful.",https://www.edx.org/sites/default/files/course/image/featured-card/analyzing_and_visualizing_data_with_excel_318x210.jpg,865855
https://www.edx.org/course/principles-statistical-and-computational-tools-for,"Principles, Statistical and Computational Tools for Reproducible Data Science","Learn skills and tools that support data science and reproducible research, to ensure you can trust your own research results, reproduce them yourself, and communicate them to others.",8 Weeks,3-8 hours per week,$99 USD,HarvardX,Data Analysis & Statistics,Intermediate,English,Missing,https://www.edx.org/sites/default/files/course/image/featured-card/ph527x-318x210.jpg,66423
https://www.edx.org/course/introduction-to-family-engagement-in-education,Introduction to Family Engagement in Education,Learn about successful collaborations between families and educators and why they lead to improved outcomes for students and schools.,6 Weeks,2-4 hours per week,$70 USD,HarvardX,Education & Teacher Training,Introductory,English,None,https://prod-discovery.edx-cdn.org/media/course/image/322eed0a-1534-4a29-a337-595f58e1fac2-85a19ae03179.small.jpg,98144
https://www.edx.org/course/fundamentos-de-ingles-basico-conversacional-y-networking,Inglés básico: conversacional y networking,Cumple tu meta de aprender inglés básico para utilizarlo de forma estratégica en los negocios e incrementar tu éxito profesional.,4 Weeks,5-8 hours per week,$49 USD,AnahuacX,Business & Management,Introductory,Español,Missing,https://prod-discovery.edx-cdn.org/media/course/image/9db66340-ca44-4ec7-8844-dc9cd51c3ceb-13957fe6ee41.small.jpeg,51194
https://www.edx.org/course/italian-language-and-culture-beginner-2019-2020,Italian Language and Culture: Beginner (2019-2020),"Learn the basics of the Italian language and culture through videos, podcasts, interviews, and much more.",12 Weeks,2-5 hours per week,$49 USD,WellesleyX,Language,Introductory,Italiano,None,https://prod-discovery.edx-cdn.org/media/course/image/1e170500-f525-46c1-b8b9-c893cf6910d3-641dfb9218ec.small.jpg,172091
https://www.edx.org/course/how-to-write-an-essay,How to Write an Essay,"An introduction to academic writing for English Language Learners, focusing on essay development, grammatical correctness, and self-editing.",5 Weeks,5-6 hours per week,$49 USD,BerkeleyX,Humanities,Introductory,English,Students should be proficient enough in English to follow an introductory level university course.,https://www.edx.org/sites/default/files/course/image/featured-card/collegewriting-378x225_0.jpg,298288
https://www.edx.org/course/backyard-meteorology-the-science-of-weather,Backyard Meteorology: The Science of Weather,Learn to forecast the weather just by looking out your window.,6 Weeks,3-5 hours per week,$49 USD,HarvardX,Science,Introductory,English,None,https://prod-discovery.edx-cdn.org/media/course/image/1bab9c85-a855-4abb-a326-9cbec5781c4c-f04010033293.small.jpg,59863
https://www.edx.org/course/steps-in-japanese-for-beginners1-part1-2,Steps in Japanese for Beginners1 Part1,Learn basic Japanese expressions to survive in Japanese.,5 Weeks,3-5 hours per week,$49 USD,WasedaX,Language,Introductory,English,Missing,https://prod-discovery.edx-cdn.org/media/course/image/840acc48-0d64-4a9d-a424-712406a034a6-2ba1eb03fbae.small.png,48464
https://www.edx.org/course/buddhism-through-its-scriptures,Buddhism Through Its Scriptures,"Learn about the rich and diverse beliefs and practices of Buddhists across time and place. Experience Buddhism through its scriptures, both relationally as well as academically.",4 Weeks,5-10 hours per week,$49 USD,HarvardX,Humanities,Introductory,English,None,https://www.edx.org/sites/default/files/course/image/featured-card/hds_3221.1x_religious_lit_318x210.jpg,178490
https://www.edx.org/course/technology-entrepreneurship-lab-to-market,Technology Entrepreneurship: Lab to Market,Explore how entrepreneurs build successful businesses by moving technology from lab to market.,5 Weeks,2-4 hours per week,$99 USD,HarvardX,Business & Management,Introductory,English,None,https://prod-discovery.edx-cdn.org/media/course/image/896ef47f-237f-47aa-a993-2beff9752254-036e4db702a9.small.png,51102
https://www.edx.org/course/strengthening-community-health-worker-programs,Strengthening Community Health Worker Programs,Learn to deliver high-quality primary health care at scale through national community health worker programs.,6 Weeks,2-4 hours per week,$79 USD,HarvardX,Health & Safety,Introductory,English,Missing,https://prod-discovery.edx-cdn.org/media/course/image/bfd20bb1-5a8a-4545-a6e3-1a32dc02f588-6a56277fbeba.small.jpg,55374
https://www.edx.org/course/data-science-inference-and-modeling,Data Science: Inference and Modeling,"Learn inference and modeling, two of the most widely used statistical tools in data analysis.",8 Weeks,1-2 hours per week,$49 USD,HarvardX,Data Analysis & Statistics,Introductory,English,Data Science: Probabilityor a basic knowledge of probability theory.,https://prod-discovery.edx-cdn.org/media/course/image/c654bfe1-69ba-4a2b-8be1-9acb2e846855-3aa512994f13.small.jpg,83601
https://www.edx.org/course/artificial-intelligence-for-everyone,AI for Everyone: Master the Basics,"Learn what Artificial Intelligence (AI) is by understanding its applications and key concepts including machine learning, deep learning and neural networks.",4 Weeks,1-2 hours per week,$49 USD,IBM,Computer Science,Introductory,English,None,https://prod-discovery.edx-cdn.org/media/course/image/f11c9289-596e-4c46-a9cb-318052f259ae-0b7656599f64.small.jpeg,43362
https://www.edx.org/course/computing-in-python-i-fundamentals-and-procedural,Computing in Python I: Fundamentals and Procedural Programming,"Learn the fundamentals of computing in Python, including variables, operators, and writing and debugging your own programs.",5 Weeks,9-10 hours per week,$99 USD,GTx,Computer Science,Introductory,English,"This course presupposes no prior knowledge beyond basic arithmetic; knowledge of high school-level algebra, however, is desirable.",https://prod-discovery.edx-cdn.org/media/course/image/e540320a-f125-4021-8f1c-9cbc84c96d87-cd703d5892ba.small.jpg,133700
https://www.edx.org/course/introduction-to-c-3,Introduction to C++,Get a brief introduction to the C++ language from the experts at Microsoft.,4 Weeks,3-5 hours per week,$99 USD,Microsoft,Computer Science,Introductory,English,"This course consists of four modules that provide an introduction to the C++ programming language. As a result, there are no prerequisites for this course. However, it is recommended that students have some understanding of basic computer operation, the ability to install applications, and the ability work within a command line on their chosen operating system.",https://prod-discovery.edx-cdn.org/media/course/image/72abaeb3-0856-4e89-906a-8b6eef402a1f-153a590f7f3c.small.jpg,325392
