Course Link,Title,Short Description,Length,Effort,Price,Institution,Subject,Level,Language,Prerequisites,Image Source,Already Enrolled
https://www.edx.org/course/information-technology-foundations,Information Technology Foundations,"Information Technology Foundations from WGU examines IT as a discipline and its various roles and functions. The course covers IT disciplines including systems and services, network and security, scripting and programming, data management, and the business of IT. The course also surveys technologies within these disciplines.",6 Weeks,9-10 hours per week,$399 USD,WGUx,Computer Science,Introductory,English,Missing,https://prod-discovery.edx-cdn.org/media/course/image/9d47f54b-dd35-4a12-941a-b1947418a58a-2a4fae090293.small.jpeg,Missing
https://www.edx.org/course/japanese-business-management,Japanese Business Management,Learn about Japanese business management and start down a path to becoming a global leader.,4 Weeks,3-5 hours per week,$129 USD,WasedaX,Business & Management,Intermediate,English,Basic business experience and/or acumen.,https://prod-discovery.edx-cdn.org/media/course/image/e15385cf-716a-4692-a597-20676073b28d-dbbb3cb44bf1.small.png,14459
https://www.edx.org/course/crear-musica-con-tecnologia,Crear música con tecnología,"Aprende sobre el proceso de producción de música y tecnología musical -incluyendo la grabación, la edición y la mezcla- y sobre las herramientas disponibles para crear música contemporánea en tu computadora.",6 Weeks,3-5 hours per week,$49 USD,BerkleeX,Music,Introductory,Español,None.,https://prod-discovery.edx-cdn.org/media/course/image/bf2e4658-f640-4c6e-b7df-319c1f460178-e877fa7a729b.small.jpg,10461
https://www.edx.org/course/disena-fabrica-y-programa-tu-propio-robot,"Diseña, fabrica y programa tu propio robot",Missing,6 Weeks,8-10 hours per week,$75 USD,UPValenciaX,Engineering,Introductory,Español,Missing,https://www.edx.org/sites/default/files/course/image/featured-card/dyor_sin_fondo_318x210.jpg,24404
https://www.edx.org/course/anatomy-gastrointestinal-reproductive-and-endocrin,"Anatomy: Gastrointestinal, Reproductive and Endocrine Systems",Missing,5 Weeks,2-3 hours per week,$49 USD,MichiganX,Biology & Life Sciences,Introductory,English,Missing,https://prod-discovery.edx-cdn.org/media/course/image/3d26bab6-5fd6-430a-a22a-1434c551300b-48268b7e1049.small.jpg,25782
https://www.edx.org/course/introduccion-a-la-genetica-y-la-evolucion,Introducción a la genética y la evolución,Missing,3 Weeks,2-3 hours per week,$49 USD,UAMx,Biology & Life Sciences,Introductory,Español,Missing,https://www.edx.org/sites/default/files/course/image/featured-card/318x210_banner-genevolx.jpg,14164
https://www.edx.org/course/ap-psychology-course-2-how-the-brain-works,AP® Psychology - Course 2: How the Brain Works,"Learn how your brain works and the basics of neuroscience, genetics and consciousness.",5 Weeks,8-12 hours per week,$49 USD,UBCx,Social Sciences,Introductory,English,None,https://www.edx.org/sites/default/files/course/image/featured-card/ap.psyc_.6x_cdcl_318x210.jpg,27448
https://www.edx.org/course/sustainable-food-security-crop-production,Sustainable Food Security: Crop Production,Learn the basics of crop production and find out how to feed the future world population without depleting our planet’s resources!,6 Weeks,6-8 hours per week,$49 USD,WageningenX,Biology & Life Sciences,Intermediate,English,Undergraduate basic biology,https://www.edx.org/sites/default/files/course/image/featured-card/gffcx-thumb-378x225.jpg,34510
https://www.edx.org/course/understanding-agribusiness-value-chains-and-consum,"Understanding Agribusiness, Value Chains, and Consumers in Global Food Systems","Learn about the dynamic business of food and agriculture, exploring value chain thinking and the role consumers play in our rapidly evolving food systems.",4 Weeks,2-3 hours per week,"₹14,889",AdelaideX,Business & Management,Intermediate,English,Missing,https://prod-discovery.edx-cdn.org/media/course/image/0097cd21-a77e-4d85-ae08-4459d3940634-28e11487a1b6.small.jpg,13308
https://www.edx.org/course/proteccion-de-datos-personales-en-la-era-digital-2,Protección de datos personales en la era digital,"Aprende conceptos, principios, roles, tendencias y tensiones sobre privacidad y proteccion de datos personales que surgen al dar tratamiento a datos personales en la era digital.",5 Weeks,8-10 hours per week,$49 USD,JaverianaX,Engineering,Introductory,Español,Ninguno,https://prod-discovery.edx-cdn.org/media/course/image/be260c23-3979-4ecf-8b0b-2c84b6184966-16c311d42423.small.jpg,5885
https://www.edx.org/course/ap-psychology-course-4-how-behavior-works,AP® Psychology - Course 4: How Behavior Works,Learn about the theories of motivation and emotions and obtain an in-depth look at intelligence testing and personality development.,6 Weeks,8-12 hours per week,$49 USD,UBCx,Social Sciences,Introductory,English,None,https://www.edx.org/sites/default/files/course/image/featured-card/ap.psyc_.6x_cdcl_318x210.jpg,23576
https://www.edx.org/course/free-cash-flow-analysis,Free Cash Flow Analysis,Learn how to use the free cash flow method for firm valuation and how to compute and project free cash flows.,5 Weeks,3-4 hours per week,$225 USD,ColumbiaX,Business & Management,Introductory,English,Students must be familiar with basic concepts of Accounting; basic skills in Microsoft Excel (or equivalent); Students should have completed Introduction to Corporate Finance.,https://www.edx.org/sites/default/files/course/image/featured-card/course_ii_image_value_to_shareholders-318210.jpg,34689
https://www.edx.org/course/circuits-and-electronics-3-applications-2,Circuits and Electronics 3: Applications,"Learn about cool applications, op-amps and filters in the design of microchips used in smartphones, self-driving cars, computers, and the internet.",7 Weeks,8-10 hours per week,$169 USD,MITx,Electronics,Intermediate,English,"You should have a mathematical background of working with calculus and basic differential equations, and a high school physics background in electricity and magnetism. You should also have taken Circuits and Electronics 1 and Circuits and Electronics 2, or have an equivalent background in basic circuit analysis and first order circuits.",https://www.edx.org/sites/default/files/course/image/featured-card/handopamp_6.002x_3_318x210.jpg,8522
https://www.edx.org/course/rethink-the-city-new-approaches-to-global-and-lo-2,Rethink the City: New Approaches to Global and Local Urban Challenges,How do you plan future cities? Explore alternative theories and innovative solutions for urban challenges in the Global South.,7 Weeks,3-4 hours per week,$50 USD,DelftX,Humanities,Introductory,English,"This course is designed for undergraduate and master's level students of architecture, urban planning and disciplines related to urban themes. Nevertheless, anyone interested in debating spatial justice, urban resilience, and housing provision and management are welcome.
No previous knowledge in urban planning or the Global South is required, just your eagerness to learn!",https://www.edx.org/sites/default/files/course/image/featured-card/arch_rtc1_edx_318x210.jpg,11920
https://www.edx.org/course/product-design-the-delft-design-approach,Product Design: The Delft Design Approach,Learn to design meaningful products and services in this introductory design course.,7 Weeks,6-8 hours per week,$79 USD,DelftX,Business & Management,Intermediate,English,Missing,https://www.edx.org/sites/default/files/course/image/featured-card/dda_home_378x225.jpg,86485
https://www.edx.org/course/shaping-work-of-the-future,Shaping Work of the Future,Explore ways to improve job opportunities and develop a personal plan for lifelong career success.,8 Weeks,4-5 hours per week,$49 USD,MITx,Business & Management,Introductory,English,None,https://prod-discovery.edx-cdn.org/media/course/image/09222e6c-a1bc-4307-ba80-294ea4281117-e28e19d05647.small.jpg,21181
https://www.edx.org/course/introduction-to-actuarial-science,Introduction to Actuarial Science,Missing,8 Weeks,2-4 hours per week,$49 USD,ANUx,Data Analysis & Statistics,Introductory,English,Missing,https://www.edx.org/sites/default/files/course/image/featured-card/actuarialx-about_page_image-318x210.jpg,51726
https://www.edx.org/course/introduction-to-geometry,Introduction to Geometry,Missing,14 Weeks,4-6 hours per week,$50 USD,SchoolYourself,Math,Introductory,English,Missing,https://prod-discovery.edx-cdn.org/media/course/image/fbef1d85-0ece-434b-8131-417658de3e5f-38747f5c6aba.small.jpg,60987
https://www.edx.org/course/calculo-diferencial,Cálculo Diferencial,El Cálculo marca una diferencia en la formación y capacidad de una persona para utilizar las matemáticas en otras ciencias y la ingeniería.,8 Weeks,5-6 hours per week,$39 USD,GalileoX,Computer Science,Intermediate,Español,"Funciones trigonometricas, exponentes, logaritmos, secuencias y series, álgebra, trigonometría analítica, geometría, geometría analítica.",https://www.edx.org/sites/default/files/course/image/featured-card/calculo_v2_318x210.jpg,22399
https://www.edx.org/course/mandarin-chinese-for-business,Mandarin Chinese for Business,Learn common Mandarin Chinese business phrases and understand Chinese culture so you can communicate professionally in the largest market in the world.,6 Weeks,4-10 hours per week,$149 USD,MandarinX,Language,Intermediate,English,Missing,https://prod-discovery.edx-cdn.org/media/course/image/c4aaf598-e64a-401b-b73d-a6861244c983-ae30fc27a71e.small.jpg,11725
https://www.edx.org/course/grabar-y-mezclar-musica,Grabar y mezclar música,Conoce y practica las técnicas y herramientas que necesita un productor musical para escribir y producir su propia música.,4 Weeks,3-5 hours per week,$49 USD,BerkleeX,Music,Introductory,Español,Missing,https://prod-discovery.edx-cdn.org/media/course/image/c588f1ee-ce25-4d39-907f-6df60d86f7f9-8586f18ead1b.small.jpg,10071
https://www.edx.org/course/activism-and-citizen-journalism-through-media,Activism and Citizen Journalism through Media,Learn how to use media to promote a social cause.,4 Weeks,2-3 hours per week,$49 USD,WitsX,Communication,Introductory,English,None,https://prod-discovery.edx-cdn.org/media/course/image/5769d728-59df-44fe-b9eb-66110979fc93-2a3fdd2797b4.small.png,6960
https://www.edx.org/course/cannabis-cultivation-and-processing,Cannabis Cultivation and Processing,"Investigate the cultivation and processing of cannabis, starting from seeds to a diversity of end products for a global market.",3 Weeks,5-10 hours per week,$179 USD,DoaneX,Environmental Studies,Introductory,English,Missing,https://prod-discovery.edx-cdn.org/media/course/image/b751afc5-0769-4c54-abcb-569de2b7472a-226c30f689ca.small.jpeg,6297
https://www.edx.org/course/italian-language-and-culture-advanced-2019-2020,Italian Language and Culture: Advanced (2019-2020),"Enhance your knowledge of the Italian language and learn about Italy’s culture and history including theater, opera and the poet Dante.",12 Weeks,3-5 hours per week,$49 USD,WellesleyX,Language,Advanced,Italiano,"Secondary school Italian (high school): 2-3 years Italian
College, University: 3-4 semesters Italian",https://prod-discovery.edx-cdn.org/media/course/image/e97a6fe0-9b5d-43c9-a3fd-7e42c37706a2-236484a9fa16.small.jpg,23800
https://www.edx.org/course/introduction-to-devops-and-site-reliability-engineering,Introduction to DevOps and Site Reliability Engineering,Learn how to start transforming your organization using the principles and practices of DevOps.,10 Weeks,1-2 hours per week,"₹11,148",LinuxFoundationX,Computer Science,Introductory,English,Intermediate understanding of Linux systems,https://prod-discovery.edx-cdn.org/media/course/image/55fee42c-4594-4060-8407-9b37ed89779d-1e07912d2088.small.png,7351
https://www.edx.org/course/pronosticos-de-ventas-una-herramienta-comercial,Pronósticos de ventas: una herramienta comercial,"Aprender a elaborar e interpretar los pronósticos de ventas, permite prevenir, desarrollar, supervisar y juzgar estrategias administrativas para cualquier tamaño de negocio, aumentar las ventas y preparase para los cambios constantes del mercado.",4 Weeks,9-10 hours per week,$49 USD,JaverianaX,Business & Management,Introductory,Español,"El curso está dirigido a emprendedores, empresarios, ejecutivos de ventas, profesionales y/o tecnólogos que tengan conocimientos de Excel.",https://www.edx.org/sites/default/files/course/image/featured-card/puj.i.1601x.1-video_still_image11232015-318x210.jpg,27140
https://www.edx.org/course/strategic-brand-management,Strategic Brand Management,"Examine product/brand management decisions and investigate the strategies and tactics to build, measure and manage brand equity.",12 Weeks,8-10 hours per week,$199 USD,CurtinX,Communication,Advanced,English,Successful completion of MKT1x and MKT2x,https://www.edx.org/sites/default/files/course/image/featured-card/mkt4x_courseabout_318x210.jpg,26304
https://www.edx.org/course/visualizacion-de-datos-y-storytelling,Visualización de Datos y Storytelling,"Aprende en este curso en línea que es la visualización de datos, sus usos; los elementos que la conforman y la forma de poder utilizarla para el apoyo en la toma de las mejores decisiones para las empresas basadas en el análisis de datos.",4 Weeks,3-5 hours per week,$49 USD,TecdeMonterreyX,Data Analysis & Statistics,Intermediate,Español,Conocimientos sobre lenguajes de programación (deseable Python),https://prod-discovery.edx-cdn.org/media/course/image/c15a33e3-a00d-4618-94d5-132e65ac8954-8068bcd9016f.small.jpeg,5192
https://www.edx.org/course/origins-of-the-human-mind,Origins of the Human Mind,"Learn about the evolutionary origins of the human mind by comparing our cognitive features to chimpanzees, our closest living relative.",5 Weeks,2-3 hours per week,$49 USD,KyotoUx,Science,Introductory,English,None,https://www.edx.org/sites/default/files/course/image/featured-card/kuyotoux_007x_banner_318x210.jpg,11537
https://www.edx.org/course/inteligencia-artificial-chatbots-sin-programacion,Inteligencia artificial: Chatbots sin programación,"Los chatbots tienen cada vez más demanda entre las empresas globales. Este curso te enseñará cómo construir, analizar, implementar y monetizar chatbots, con la ayuda de IBM Watson y el poder de la IA.",2 Weeks,2-4 hours per week,$49 USD,IBM,Computer Science,Introductory,Español,Missing,https://prod-discovery.edx-cdn.org/media/course/image/b7e4f7cf-e64b-46c9-ae14-d99deb7b11c0-b8fdd5935456.small.png,Missing
https://www.edx.org/course/the-iterative-innovation-process,The Iterative Innovation Process,Experience the iterative innovation process and learn how you can use this process to develop your own innovative ideas.,8 Weeks,4-6 hours per week,$99 USD,MITx,Business & Management,Introductory,English,None.,https://www.edx.org/sites/default/files/course/image/featured-card/2016_version_of_3.086x_318x210.jpg,59814
https://www.edx.org/course/fundamentals-of-market-structure,Fundamentals of Market Structure,Missing,1 Weeks,1-2 hours per week,$25 USD,NYIF,Economics & Finance,Introductory,English,Missing,https://www.edx.org/sites/default/files/course/image/featured-card/nyif_etm2016.1x_-_318x210.jpg,31631
https://www.edx.org/course/pensamiento-critico-toma-de-decisiones-razonadas,Pensamiento crítico: toma de decisiones razonadas,Aprende a analizar eventos con rigor intelectual. Identifica como las decisiones razonadas ayudan a enfrentar el cambio.,4 Weeks,5-8 hours per week,"₹11,148",TecdeMonterreyX,Business & Management,Introductory,Español,Estudios de profesional concluidos.,https://prod-discovery.edx-cdn.org/media/course/image/c2105c0c-ab59-4ba8-80fa-e6a01334432f-fb83a5828049.small.jpg,15843
https://www.edx.org/course/sharks-global-biodiversity-biology-and-conservatio,Sharks!,"Learn about the most fascinating animals on Earth, their sophisticated senses and how sharks and their relatives have impacted human history and culture.",4 Weeks,4-6 hours per week,$199 USD,"CornellX
UQx",Biology & Life Sciences,Introductory,English,Secondary School (high school) biology,https://www.edx.org/sites/default/files/course/image/featured-card/bioee101x_course_image2.png,32510
https://www.edx.org/course/leadership-and-organizational-behavior,Leadership and organizational behavior,"This course will Challenge you to develop who you are and could be as a leader, develop what type of leader you could be depends on empowering your strengths and ability to adapt your behavior according to the situation.",4 Weeks,5-8 hours per week,$149 USD,TecdeMonterreyX,Business & Management,Intermediate,English,Bachelor's Degree Level,https://prod-discovery.edx-cdn.org/media/course/image/5f30cd7d-bf7d-449d-bffe-535e70d8c5c9-7f6d18ef1a03.small.jpeg,Missing
https://www.edx.org/course/les-principes-de-la-finance,Les principes de la finance,S'équiper de la boîte à outils du financier pour prendre des décisions judicieuses d'investissement ou d'épargne.,13 Weeks,4-7 hours per week,$150 USD,LouvainX,Business & Management,Intermediate,Français,Mathématiques niveau école secondaire,https://www.edx.org/sites/default/files/course/image/featured-card/les-principes-de-la-finance_378x225.jpg,42620
https://www.edx.org/course/arab-islamic-history-from-tribes-to-empires,Arab-Islamic History: From Tribes to Empires,"Learn about the history of the Arab and Muslim world during its first millennium, including political, social and cultural aspects.",8 Weeks,3-4 hours per week,$49 USD,"IsraelX
TelAvivUniversity",Humanities,Introductory,English,None,https://www.edx.org/sites/default/files/course/image/featured-card/islam101x_318x210.jpg,16618
https://www.edx.org/course/big-data-and-education,Big Data and Education,Learn the methods and strategies for using large-scale educational data to improve education and make discoveries about learning.,8 Weeks,6-12 hours per week,$169 USD,PennX,Data Analysis & Statistics,Advanced,English,"Basic knowledge of statistics, data mining, mathematical modeling, or algorithms is recommended. Experience with programming is not required.",https://www.edx.org/sites/default/files/course/image/featured-card/bde1x-big_data_in_education-378x225b.jpg,14390
https://www.edx.org/course/principios-de-analisis-e-instrumentos-financieros,Principios de Análisis e Instrumentos Financieros,"Este curso está desarrollo para que el participante cuente con un sólido conocimiento de las finanzas empresariales básicas y pueda tomar las mejores decisiones, que signifiquen la mayor rentabilidad y maximización del valor de la empresa.",5 Weeks,5-7 hours per week,$49 USD,AnahuacX,Economics & Finance,Intermediate,Español,Missing,https://prod-discovery.edx-cdn.org/media/course/image/fd5c1669-c7a3-4c41-b648-2df71bd8251f-d2ba41963027.small.jpeg,Missing
https://www.edx.org/course/influencing-stakeholders-discover-your-leadershi-2,Dealing with Power and Dynamics: Discover Your Leadership Style and Influence Stakeholders,Missing,5 Weeks,4-5 hours per week,$125 USD,DelftX,Business & Management,Intermediate,English,Missing,https://prod-discovery.edx-cdn.org/media/course/image/dfdf39ce-705d-4a34-9172-f517338966a1-56fe343aa4c9.small.jpg,15586
https://www.edx.org/course/unlocking-your-employability,Unlocking Your Employability,Learn how to unlock your personal and professional development and market your skills to potential employers to maximise your career success.,7 Weeks,1-2 hours per week,"₹4,414",UQx,Humanities,Introductory,English,None,https://www.edx.org/sites/default/files/course/image/featured-card/employ101x-video_still_image-318x210.jpg,47462
https://www.edx.org/course/pensamento-critico-tomada-de-decisoes-fundamentadas,Pensamento crítico: tomada de decisões fundamentadas,Aprende a analisar eventos com rigor intelectual. Identifica como as decisões fundamentadas ajudam a lidar com as mudanças.,4 Weeks,5-8 hours per week,$149 USD,TecdeMonterreyX,Business & Management,Introductory,Português,Nível de licenciatura,https://prod-discovery.edx-cdn.org/media/course/image/0065a670-7b48-4d7f-af6d-af3a5ed1a0ac-4c7be9cfb35f.small.jpeg,Missing
https://www.edx.org/course/media-law,Media Law,Build your expertise in legal frameworks and ethical issues surrounding design and digital media,14 Weeks,8-10 hours per week,$249 USD,NYUx,Art & Culture,Introductory,English,We strongly recommend taking the Integrated Digital Media MicroMasters in the following sequence:,https://prod-discovery.edx-cdn.org/media/course/image/32af23de-41e5-403f-8f7c-911eb84fb455-77e2056ccf02.small.jpg,6427
https://www.edx.org/course/music-for-wellness,Music For Wellness,"Learn how music can help reduce stress and improve your health, and well-being.",4 Weeks,3-5 hours per week,$49 USD,BerkleeX,Humanities,Introductory,English,None,https://prod-discovery.edx-cdn.org/media/course/image/3d0c3712-cacb-4e78-aad2-5c0e1ecb97f0-cee4844d8409.small.jpg,19020
https://www.edx.org/course/sustainable-tourism-society-environmental-aspects,Sustainable Tourism: Society & Environmental Aspects,Gain the skills and knowledge to drive sustainability in the largest industry worldwide: tourism! Understand the scope next to social and environmental implications of growth in this exciting field of study.,6 Weeks,5-7 hours per week,$99 USD,WageningenX,Social Sciences,Introductory,English,None.,https://prod-discovery.edx-cdn.org/media/course/image/1bd4c918-3b9b-4fa9-8b79-740f35388f65-c8c5b7d53e2b.small.jpg,12243
https://www.edx.org/course/the-science-of-parenting,The Science of Parenting,Missing,5 Weeks,3-5 hours per week,$49 USD,UCSanDiegoX,Social Sciences,Introductory,English,Missing,https://prod-discovery.edx-cdn.org/media/course/image/a379c18c-92a8-4ff7-b271-33398cccbfcf-815b2b15b51f.small.jpg,36794
https://www.edx.org/course/negotiation-strategies-and-styles,Negotiation Strategies and Styles,It describes the different negotiation strategies based on expected results and their impact on the relationship between the parties involved.,4 Weeks,5-8 hours per week,"₹11,148",TecdeMonterreyX,Business & Management,Intermediate,English,Bachelor's Degree Level.,https://prod-discovery.edx-cdn.org/media/course/image/a73fad00-44d0-475e-937f-090489d8563d-98139738aad5.small.jpeg,Missing
https://www.edx.org/course/cwr-1850-1861-a-house-divided,The Civil War and Reconstruction - 1850-1861: A House Divided,"Discover how the issue of slavery came to dominate American politics, and how political leaders struggled and failed to resolve the growing crisis in the nation.",15 Weeks,6-8 hours per week,$50 USD,ColumbiaX,History,Introductory,English,None,https://prod-discovery.edx-cdn.org/media/course/image/01f88482-c127-4130-b928-902d39e5b326-bf578aa4c27e.small.jpg,23027
https://www.edx.org/course/dna-biologys-genetic-code,DNA: Biology’s Genetic Code,DNA carries the defining data for life in a simple genetic code that comes with its own “back-up” system. Explore DNA structure with us!,6 Weeks,4-6 hours per week,$169 USD,RICEx,Biology & Life Sciences,Intermediate,English,High school chemistry and biology and BIOC300.1x OR understanding and knowledge of protein structure and function,https://www.edx.org/sites/default/files/course/image/featured-card/bioc300.2x-course_image-378x225.jpg,34475
https://www.edx.org/course/algorithmic-design-and-techniques,Algorithmic Design and Techniques,Missing,6 Weeks,8-10 hours per week,$99 USD,UCSanDiegoX,Computer Science,Intermediate,English,Missing,https://prod-discovery.edx-cdn.org/media/course/image/a22d222a-a1d8-4629-9d4f-474cafeb9442-43b3ea5b468b.small.jpg,39507
https://www.edx.org/course/intro-to-watson-AI,Introduction to Watson AI,Learn how to quickly and easily get started with Artificial Intelligence using IBM Watson.,8 Weeks,4-8 hours per week,$49 USD,IBM,Computer Science,Introductory,English,Missing,https://prod-discovery.edx-cdn.org/media/course/image/49c3c17c-ac4a-4140-8fe0-336f8f7e3987-f6db885b26a4.small.png,Missing
https://www.edx.org/course/risk-management-and-credit-principles,Risk Management and Credit Principles,"Get introduced to risk management, credit principles, and business risk as they relate to a borrower.",6 Weeks,2-3 hours per week,$199 USD,NYIF,Economics & Finance,Advanced,English,Missing,https://prod-discovery.edx-cdn.org/media/course/image/0a796b48-6754-4767-9e6a-d28bbde77561-8a14dac24d29.small.jpg,8491
https://www.edx.org/course/climate-change-the-science-and-global-impact,Climate Change: The Science and Global Impact,We need to understand the sciencebehind global warming to avoid the most damaging and irreversible climate change impacts on people and planet.,8 Weeks,2-4 hours per week,$49 USD,SDGAcademyX,Energy & Earth Sciences,Intermediate,English,Missing,https://prod-discovery.edx-cdn.org/media/course/image/32779451-9094-45c8-9805-505bfe77ae02-febc6b6268d5.small.png,16070
https://www.edx.org/course/global-politics,Global Politics,"Join us on a cosmopolitan adventure through politics, society, conflict and nature, and ask yourself, as we look to the future of humanity, whether there is one global order that is sufficiently complex to be both lasting and sustainable.",6 Weeks,4-6 hours per week,$59 USD,FedericaX,Social Sciences,Introductory,English,Missing,https://prod-discovery.edx-cdn.org/media/course/image/9dfa5126-51e2-4d67-ab49-9e2268d80a1f-b80f2eaf88ab.small.jpg,8643
