Course Link,Title,Short Description,Length,Effort,Price,Institution,Subject,Level,Language,Prerequisites,Image Source,Already Enrolled
https://www.edx.org/course/project-management-for-development,Project Management for Development,A MOOC developed in collaboration with the Project Management Institute Educational Foundation (PMIEF). Learn best practices for managing projects that promote economic and social development in Latin America and the Caribbean.,10 Weeks,3-4 hours per week,$49 USD,IDBx,Business & Management,Intermediate,English,Missing,https://prod-discovery.edx-cdn.org/media/course/image/17e30556-8e90-4005-b59b-0de1a07a1ab4-c63a23768f0f.small.jpeg,60989
https://www.edx.org/course/business-foundations,Business Foundations,This is business in a nutshell; learn key concepts and frameworks that underpin business.,6 Weeks,3-5 hours per week,$150 USD,UBCx,Business & Management,Introductory,English,None,https://prod-discovery.edx-cdn.org/media/course/image/1c30e9b3-78ee-4c57-9af9-922153073d99-9ee0f4e21475.small.jpg,53798
https://www.edx.org/course/digital-design,Digital Design,"The course is an introduction to digital design technology. It allows you to understand the basics of digital design and helps you develop skills from computer aided design to animation covering topics such as rigging, key framing, rendering and more.",5 Weeks,5-6 hours per week,$50 USD,HKUSTx,Design,Introductory,English,Secondary school (high school) algebra; basic programming concepts,https://prod-discovery.edx-cdn.org/media/course/image/fff9bb19-b736-4eb3-913c-0460063da31c-9fca8a885546.small.png,11011
https://www.edx.org/course/japanese-pronunciation-for-communication,Japanese Pronunciation for Communication,Practice pronunciation and improve your spoken Japanese in context.,5 Weeks,3-5 hours per week,$99 USD,WasedaX,Communication,Introductory,日本語,Missing,https://www.edx.org/sites/default/files/course/image/featured-card/jpc111x_course_image_ver1c_green_318x210.jpg,60585
https://www.edx.org/course/designing-and-creating-skirts,Designing and Creating Skirts,"Learn the construction and style adaptations of skirts from a design and creation perspective, completing the course with your own designed, and made to measure finished skirt sample.",5 Weeks,3-5 hours per week,$100 USD,HKPolyUx,Design,Introductory,English,None,https://prod-discovery.edx-cdn.org/media/course/image/d58bb967-9006-456a-9a98-bd58be172d15-21e460be2a1e.small.jpg,12421
https://www.edx.org/course/analisis-estadistico-con-excel,Análisis estadístico con Excel,"Este curso en línea entrega al estudiante los conocimientos fundamentales de estadística para el análisis de datos, tanto a nivel personal como empresarial.",4 Weeks,3-5 hours per week,$49 USD,GalileoX,Data Analysis & Statistics,Introductory,Español,Conocimiento elemental de Estadistica y manejo de Excel.,https://prod-discovery.edx-cdn.org/media/course/image/b7a65a5c-7137-4c1d-bb40-16496d3e0571-642fac1dcc95.small.jpg,21459
https://www.edx.org/course/introduction-to-cloud-infrastructure-technologies,Introduction to Cloud Infrastructure Technologies,"Learn the fundamentals of building and managing cloud technologies directly from The Linux Foundation, the leader in open source.",14 Weeks,3-4 hours per week,$169 USD,LinuxFoundationX,Computer Science,Introductory,English,Missing,https://prod-discovery.edx-cdn.org/media/course/image/001b82e7-0fa7-4c31-839d-d8a71c9afc60-b0f00350d9a9.small.png,84615
https://www.edx.org/course/anatomy-musculoskeletal-and-integumentary-systems,Anatomy: Musculoskeletal and Integumentary Systems,"Learn about the integumentary system (skin, hair, nails, and glands), and how the bones, joints, and muscles of the musculoskeletal system function.",4 Weeks,2-3 hours per week,$49 USD,MichiganX,Biology & Life Sciences,Introductory,English,Basic biology,https://prod-discovery.edx-cdn.org/media/course/image/de2fa4fb-2a12-4824-9184-3e5e04fa0e7a-29cb3a414e0c.small.jpg,49978
https://www.edx.org/course/financial-development-and-financial-inclusion,Financial Development and Financial Inclusion,"Learn how to develop an efficient, inclusive and stable financial sector that is essential for a thriving economy.",7 Weeks,8-10 hours per week,$25 USD,IMFx,Economics & Finance,Intermediate,English,Missing,https://prod-discovery.edx-cdn.org/media/course/image/f9c23be1-aba6-422d-a10e-b3c02331426d-b1ccfd3b305b.small.png,12484
https://www.edx.org/course/epidemics-i,Epidemics I,"Explore the science, prevention and control of epidemics in this free online course. In addition to lectures by leading scientists in this field from HKU, this course will feature panel discussions with world leading experts in epidemics.",5 Weeks,2-3 hours per week,$139 USD,HKUx,Medicine,Introductory,English,None.,https://prod-discovery.edx-cdn.org/media/course/image/38362c5d-d3ac-4416-856e-8165382026fc-f7d86fe27cf2.small.jpg,10082
https://www.edx.org/course/introduction-to-algebra,Introduction to Algebra,"Solve equations, draw graphs, and play with quadratics in this interactive course!",4 Weeks,4-6 hours per week,$139 USD,SchoolYourself,Math,Introductory,English,None,https://prod-discovery.edx-cdn.org/media/course/image/64f34469-e385-40a4-92af-67ab8e3a18eb-1a5112257328.small.jpg,128771
https://www.edx.org/course/mi-propia-huerta-organica,Mi propia huerta orgánica,"Este curso está realizado por profesionales para todas aquellas personas que tienen ganas de tener una huerta orgánica, que consideran que es muy importante el cultivo, sus propias hortalizas, plantas aromáticas, frutales, beneficiosos para el cuidado de su salud y la economía familiar.",4 Weeks,1-2 hours per week,$29 USD,UNCordobaX,Biology & Life Sciences,Introductory,Español,Ninguno,https://prod-discovery.edx-cdn.org/media/course/image/f3eb7386-7ca7-42c4-a67f-fee1d2060b7f-ddd6a46e02ae.small.png,9330
https://www.edx.org/course/tourism-and-travel-management,Tourism and Travel Management,Leading tourism practitioners and researchers offer insider perspectives on this dynamic and growing industry.,7 Weeks,2-3 hours per week,$5 USD,UQx,Business & Management,Introductory,English,None,https://prod-discovery.edx-cdn.org/media/course/image/8aa52991-e1ba-4157-9a8e-0bf673f116e8-15779335d9e6.small.jpg,37104
https://www.edx.org/course/disaster-medicine-training,Disaster Medicine Training,Welcome to Disaster Medicine Training.,8 Weeks,1-2 hours per week,$50 USD,StanfordOnline,Medicine,Introductory,English,No prerequisites are required for this course.,https://prod-discovery.edx-cdn.org/media/course/image/2c3a98df-1e2c-4c1a-9024-a37996d62390-12b3ade121e2.small.png,9328
https://www.edx.org/course/blockchain-technology,Blockchain Technology,Missing,6 Weeks,3-5 hours per week,$99 USD,BerkeleyX,Computer Science,Intermediate,English,Missing,https://prod-discovery.edx-cdn.org/media/course/image/17b2db20-bb6d-4148-ad0b-9b9b99e287c1-09409ec35d10.small.png,53735
https://www.edx.org/course/introduccion-al-desarrollo-de-aplicaciones-web-2,Introducción al desarrollo de aplicaciones web,Missing,5 Weeks,4-5 hours per week,$49 USD,UAMx,Computer Science,Introductory,Español,Missing,https://prod-discovery.edx-cdn.org/media/course/image/2dcbd011-56c5-4e4a-80eb-aa2a080c1164-41805b303158.small.png,25581
https://www.edx.org/course/tsinghua-chinese-start-talking-with-13-billion-peo,Tsinghua Chinese: Start Talking with 1.3 Billion People,Beginners' Chinese course from China's top university.,6 Weeks,2-3 hours per week,$49 USD,TsinghuaX,Language,Introductory,English,None,https://www.edx.org/sites/default/files/course/image/featured-card/tm01x-video_still_image_12012015-318x210.jpg,57658
https://www.edx.org/course/ap-microeconomics,AP® Microeconomics,An overview of introductory microeconomics. Learn the key principles of economics and how to apply them to the real world - and the AP® exam!,12 Weeks,3-4 hours per week,$49 USD,MITx,Economics & Finance,Introductory,English,None,https://www.edx.org/sites/default/files/course/image/featured-card/14.01x_su17_courseimage_318x210.jpg,51233
https://www.edx.org/course/leading-with-effective-communication-inclusive-lea,Leading With Effective Communication (Inclusive Leadership Training),Missing,4 Weeks,1-2 hours per week,$50 USD,CatalystX,Communication,Introductory,English,Missing,https://www.edx.org/sites/default/files/course/image/featured-card/il5x_banner318x210_0.jpg,105369
https://www.edx.org/course/introduction-to-developmental-psychology,Introduction to Developmental Psychology,"Learn how we develop over our lifetime, including our ability to think, communicate, and form social attachments.",8 Weeks,1-2 hours per week,$99 USD,UQx,Humanities,Introductory,English,None,https://www.edx.org/sites/default/files/course/image/featured-card/psyc101.2x_developmental_318x210.jpg,36610
https://www.edx.org/course/philosophy-and-critical-thinking,Philosophy and Critical Thinking,Missing,6 Weeks,1-4 hours per week,$99 USD,UQx,Humanities,Introductory,English,Missing,https://www.edx.org/sites/default/files/course/image/featured-card/meta101x-philosophy_and_critical_thinking-course_image-378x225.jpg,93843
https://www.edx.org/course/fundamentals-of-red-hat-enterprise-linux,Fundamentals of Red Hat Enterprise Linux,Missing,9 Weeks,1-3 hours per week,$99 USD,RedHat,Computer Science,Introductory,English,Missing,https://www.edx.org/sites/default/files/course/image/featured-card/redhat_rh066x_318x210.jpg,51982
https://www.edx.org/course/academic-writing-for-clarity-and-meaning-2,Academic writing for clarity and meaning,Missing,2 Weeks,2-3 hours per week,$49 USD,WitsX,Education & Teacher Training,Introductory,English,Missing,https://prod-discovery.edx-cdn.org/media/course/image/448ff87c-fc1b-4056-a6cb-54ad1f6f6d8a-43c57c4d4935.small.png,14702
https://www.edx.org/course/the-science-of-beer,The Science of Beer,"Are you interested in more than just the taste of beer? Discover what's in your beer, howit's made and marketed and the effectit hason your body and health.",6 Weeks,2-4 hours per week,$49 USD,WageningenX,Food & Nutrition,Introductory,English,None,https://prod-discovery.edx-cdn.org/media/course/image/8a140470-bc70-4f7f-a9aa-df0284469b0b-487dcdb71f1d.small.jpg,37765
https://www.edx.org/course/working-in-teams-a-practical-guide,Working in Teams: A Practical Guide,"Learn how to build effective teams, be a great team player and manage team conflict.",4 Weeks,6-8 hours per week,$49 USD,UQx,Humanities,Introductory,English,None,https://www.edx.org/sites/default/files/course/image/featured-card/teams101x-banner.jpg,43356
https://www.edx.org/course/nutrition-and-cancer,Nutrition and Cancer,"Discover the latest insights on the role of diet, nutrition and lifestyle in the prevention, occurrence and progression of cancer.",5 Weeks,6-8 hours per week,$99 USD,WageningenX,Food & Nutrition,Intermediate,English,Knowledge of basic biology is useful,https://prod-discovery.edx-cdn.org/media/course/image/be59ab30-2dfa-42fa-8363-630c34e94019-da0118a49c5b.small.jpg,25791
https://www.edx.org/course/what-do-architects-and-urban-planners-do,What do Architects and Urban Planners do?,Discover how spatial design professionals make a difference in society,3 Weeks,2-3 hours per week,$49 USD,WitsX,Architecture,Introductory,English,None,https://prod-discovery.edx-cdn.org/media/course/image/55eacb7a-8b3a-49a1-be9b-68dbde83ded3-9ad338bf5609.small.jpg,9748
https://www.edx.org/course/italian-language-and-culture-intermediate-2019-202,Italian Language and Culture: Intermediate (2019-2020),"Improve your Italian language skills and expand your vocabulary while you learn about Italian art, literature and contemporary society.",12 Weeks,3-5 hours per week,"₹3,666",WellesleyX,Language,Intermediate,Italiano,"Secondary school Italian (high school): 1-2 years Italian
College, University: 1-2 semesters Italian",https://prod-discovery.edx-cdn.org/media/course/image/b6bb8a1e-cece-4c43-a3dc-3b00e6843f25-17ba1808405d.small.jpg,33136
https://www.edx.org/course/computing-in-python-ii-control-structures,Computing in Python II: Control Structures,"Learn about control structures, one of the most powerful parts of programming. This course covers conditionals, loops, functions, and error handling, specifically in Python but with broader applicability to other languages as well.",5 Weeks,9-10 hours per week,$99 USD,GTx,Computer Science,Introductory,English,"CS1301xI or equivalent knowledge is required. Certain problems may benefit from experience with algebra, geometry, pre-calculus, and trigonometry, but you can succeed without these.",https://prod-discovery.edx-cdn.org/media/course/image/80a9dc0a-c757-4a98-bf12-f6828b5295c4-0af8840e563f.small.jpg,29864
https://www.edx.org/course/statistics-for-business-i,Statistics for Business – I,Missing,5 Weeks,2-4 hours per week,$50 USD,IIMBx,Business & Management,Intermediate,English,Missing,https://www.edx.org/sites/default/files/course/image/featured-card/qm101.1x-statistics-for-business-378x225.jpg,62491
https://www.edx.org/course/preparing-to-network-in-english,Preparing to Network in English,Learn the basics of networking while you grow your social network and professional connections. Practice speaking to improve your English language skills for increased success in job hunting.,6 Weeks,3-5 hours per week,$149 USD,UWashingtonX,Language,Introductory,English,Intermediate level of English language proficiency,https://prod-discovery.edx-cdn.org/media/course/image/84960556-7bfe-4c56-9a91-7bf53ac97d23-0f14f36f6c69.small.jpg,32120
https://www.edx.org/course/liderazgo-y-comportamiento-organizacional,Liderazgo y comportamiento organizacional,"Aprende a desarrollar tu potencial como líder, desarrolla habilidades de motivación, liderazgo y negociación.",4 Weeks,5-8 hours per week,$149 USD,TecdeMonterreyX,Business & Management,Introductory,Español,Estudios de profesional concluidos.,https://prod-discovery.edx-cdn.org/media/course/image/65edec3e-09f7-4320-b541-889d2303135a-e1b5e1e5e717.small.jpg,19387
https://www.edx.org/course/teaching-critical-thinking-through-art-with-the-na,Teaching Critical Thinking through Art with the National Gallery of Art,"Learn how to integrate works of art using Artful Thinking routines, effective strategies from Project Zero at Harvard University, in this interactive online course for teachers of all levels and subjects.",16 Weeks,3-4 hours per week,$25 USD,SmithsonianX,Education & Teacher Training,Introductory,English,Missing,https://prod-discovery.edx-cdn.org/media/course/image/7de4699c-585a-4657-a93d-cc26bd324142-55a26eac4354.small.jpg,17498
https://www.edx.org/course/linear-algebra-foundations-to-frontiers,Linear Algebra - Foundations to Frontiers,Learn the mathematics behind linear algebra and link it to matrix software development.,15 Weeks,6-10 hours per week,$49 USD,UTAustinX,Computer Science,Intermediate,English,"High School Algebra, Geometry, and Pre-Calculus.",https://www.edx.org/sites/default/files/course/image/featured-card/ut.5.01x_378x225.jpg,85364
https://www.edx.org/course/business-communications,Business Communications,Learn how to communicate effectively in a business setting: understand diverse audiences and build sound arguments.,6 Weeks,3-5 hours per week,$150 USD,UBCx,Business & Management,Introductory,English,None,https://prod-discovery.edx-cdn.org/media/course/image/5776bb8e-e7c0-49de-8123-0b918c882ff0-bd0d4a4db495.small.jpg,59607
https://www.edx.org/course/embedded-systems-shape-the-world-microcontroller-i,Embedded Systems - Shape The World: Microcontroller Input/Output,Missing,8 Weeks,8-10 hours per week,$49 USD,UTAustinX,Computer Science,Intermediate,English,"Computer programming course in any language with exposure to variables, arithmetic, logic, loops, and functions. High school physics course covering current, voltage, resistance, and power.",https://www.edx.org/sites/default/files/course/image/featured-card/embedded-systems_shape-the-world_378x225.jpg,67159
https://www.edx.org/course/latex-for-students-engineers-and-scientists-2,"LaTeX for Students, Engineers, and Scientists","Explore a new way of writing and typesetting articles, books, papers, etc. using a document preparation system called LaTeX.",7 Weeks,3-4 hours per week,$139 USD,IITBombayX,Engineering,Introductory,English,"There are no prerequisites for this course, except knowledge of editing text. The course can be taken by any learner who wants to create documents using LaTeX.",https://prod-discovery.edx-cdn.org/media/course/image/d6d21d69-5349-41cc-9bc4-952114aa3a07-a8c4ebd57751.small.jpg,10046
https://www.edx.org/course/algorithms-2,Algorithms,Learn how to structure and use algorithms to solve real life problems.,6 Weeks,6-8 hours per week,$149 USD,IITBombayX,Computer Science,Intermediate,English,Concepts of data structures as covered in ‘Foundations of Data Structures’ and ‘Implementation of Data Structures’ courses.,https://prod-discovery.edx-cdn.org/media/course/image/67922253-808e-4ae0-aaa7-ecdb4989e4c0-e26d8ffb201a.small.png,60662
https://www.edx.org/course/storytelling-for-social-change,Storytelling for Social Change,Missing,5 Weeks,1-3 hours per week,$49 USD,MichiganX,Communication,Introductory,English,Missing,https://prod-discovery.edx-cdn.org/media/course/image/bb8d8107-29c6-4004-9a9d-088ca28a7dda-efd1d180b91d.small.png,29111
https://www.edx.org/course/habilidades-de-negociacion-y-comunicacion-efectiva,Habilidades de negociación y comunicación efectiva,"Aprende a analizar la perspectiva “social” de una negociación y su impacto en acuerdos exitosos, así como los riesgos de ignorarla o desconocer su aplicabilidad.",4 Weeks,5-8 hours per week,$149 USD,TecdeMonterreyX,Business & Management,Introductory,Español,Estudios de profesional concluidos.,https://prod-discovery.edx-cdn.org/media/course/image/02947b3d-4475-44ec-9721-e3db83ebba8e-f6572fe7553b.small.jpg,17360
https://www.edx.org/course/stravinskys-rite-of-spring-modernism-ballet-and-ri,"First Nights - Stravinsky’s Rite of Spring: Modernism, Ballet, and Riots","Learn the fascinating history of Igor Stravinsky’s The Rite of Spring , one of the most challenging and rewarding ballets ever written.",3 Weeks,3-5 hours per week,$49 USD,HarvardX,Humanities,Introductory,English,Missing,https://www.edx.org/sites/default/files/course/image/featured-card/course_image_318x210_9.jpg,16955
https://www.edx.org/course/introduction-to-animal-behaviour,Introduction to Animal Behaviour,"Explore the amazing range and complexity of wild animal behaviour. Discover how animals learn, communicate, find food, avoid predators, and interact socially.",6 Weeks,4-6 hours per week,$49 USD,WageningenX,Biology & Life Sciences,Introductory,English,Missing,https://www.edx.org/sites/default/files/course/image/featured-card/anim_behav_mooc_318x210.jpg,40901
https://www.edx.org/course/web-accessibility-introduction,Introduction to Web Accessibility,"Get a strong foundation in digital accessibility to make your websites and apps work well for people with disabilities, meet international standards, and provide a better user experience for everyone.",4 Weeks,4-5 hours per week,$99 USD,W3Cx,Computer Science,Introductory,English,None,https://prod-discovery.edx-cdn.org/media/course/image/8ac6f7ff-0ff9-4894-a5f3-cc34fc5768fa-8357c71f5fa0.small.png,13735
https://www.edx.org/course/international-womens-health-and-human-rights,International Women's Health and Human Rights,"This self-paced course provides an overview of women's health and human rights, beginning in infancy and childhood, then moving through adolescence, reproductive years and aging. We consider economic, social, political and human rights factors, and the challenges women face in maintaining health and managing their lives in the face of societal pressures and obstacles.",10 Weeks,1-5 hours per week,$50 USD,StanfordOnline,Social Sciences,Introductory,English,Missing,https://prod-discovery.edx-cdn.org/media/course/image/07225023-cfa3-4ce9-ba7a-9c7278ce2167-d1cf7e4ee59f.small.jpeg,8354
https://www.edx.org/course/global-public-health,Global Public Health,"Understanding the value of health not just as a benefit or right of individuals, but as a global public need.",10 Weeks,4-6 hours per week,$49 USD,SDGAcademyX,Health & Safety,Intermediate,English,None.,https://prod-discovery.edx-cdn.org/media/course/image/e4315d22-de5d-4574-951a-be74baa8a8fa-88b0aeca55fb.small.jpg,16233
https://www.edx.org/course/epidemics-ii,Epidemics II,"Explore the science, prevention and control of epidemics in this free online course. In addition to lectures by leading scientists in this field from HKU, this course will feature a supplementary module on COVID-19 and panel discussions with world leading experts in epidemics.",3 Weeks,2-3 hours per week,$139 USD,HKUx,Medicine,Introductory,English,None.,https://prod-discovery.edx-cdn.org/media/course/image/7960e964-4a36-4e38-9766-08bd7b149ebb-fb5b104f88a4.small.jpeg,8416
https://www.edx.org/course/qualitative-research-methods-conversational-interv,Qualitative Research Methods: Conversational Interviewing,"A short course that will teach you how to prepare for and conduct conversational interviews, that will produce rich qualitative data.",3 Weeks,2-3 hours per week,$49 USD,MITx,Humanities,Intermediate,English,None,https://prod-discovery.edx-cdn.org/media/course/image/8919d2dd-d33b-4fca-a8f6-d96d95d6484d-3d02c6658b21.small.jpg,20676
https://www.edx.org/course/facebook-ads-como-utilizar-el-poder-de-la-publicid,Facebook Ads: Cómo utilizar el poder de la publicidad en Facebook,"Aprende a crear campañas publicitarias exitosas. Accede a tutoriales paso a paso de Audience Insights, Pixel de Facebook, A/B Testing y más.",5 Weeks,3-4 hours per week,$49 USD,GalileoX,Communication,Introductory,Español,Requisitos previos:,https://prod-discovery.edx-cdn.org/media/course/image/8721fa51-087f-4256-92ab-07c0e62b6800-a2e7e60ab7da.small.png,27794
https://www.edx.org/course/evaluating-social-programs-3,Evaluating Social Programs,Understand how randomized evaluations can be used to evaluate social and development programs.,6 Weeks,3-5 hours per week,$99 USD,MITx,Social Sciences,Intermediate,English,"Although not required, prior familiarity with basic statistical concepts is recommended.",https://www.edx.org/sites/default/files/course/image/featured-card/jpal101x_social_course_featured380x168.jpg,31679
https://www.edx.org/course/disena-presentaciones-eficaces-con-powerpoint,Diseña presentaciones eficaces con Powerpoint,Missing,3 Weeks,4-10 hours per week,$50 USD,UPValenciaX,Computer Science,Introductory,Español,Missing,https://prod-discovery.edx-cdn.org/media/course/image/7368c1bf-16e5-4dc9-9a0d-6d6ba62b8b54-f4eece04d550.small.jpg,35397
https://www.edx.org/course/software-development-fundamentals,Software Development Fundamentals,Missing,4 Weeks,6-8 hours per week,$149 USD,PennX,Computer Science,Intermediate,English,Missing,https://prod-discovery.edx-cdn.org/media/course/image/ba043ab4-e985-413d-b727-5d10b661fcb5-57033ef83e67.small.jpg,50029
https://www.edx.org/course/digital-transformation-business-development-and-ma,Digital Transformation: Business Development and Marketing,Learn how to evolve and market your product and services in a digitally transforming business landscape.,10 Weeks,2-3 hours per week,"₹9,651",KTHx,Business & Management,Intermediate,English,"There are no set prerequisites for this course. However, if you're ideally suited, you have at least basic, perhaps advanced knowledge in digital development. You're fairly digital yourself. Most likely you use a smartphone. You are probably a working person, maybe in a management position in an organization. You are at a time and a place where the issues mentionedon this page are heavily debated.",https://prod-discovery.edx-cdn.org/media/course/image/f2be9c4d-7f00-40d4-9182-e087dd8c6324-14290c871ba0.small.png,14220
https://www.edx.org/course/pre-university-calculus-2,Pre-University Calculus,Prepare for Introductory Calculus courses.,8 Weeks,6-8 hours per week,$50 USD,DelftX,Math,Introductory,English,This course revises high school level mathematics and is aimed to close the readiness gap between high school and university.,https://www.edx.org/sites/default/files/course/image/featured-card/pre-university-calculus_378x225_0.jpg,100652
https://www.edx.org/course/gestion-de-projets-de-developpement,Gestion de projets de développement,Un MOOC conçu en collaboration avec le Project Management Institute Educational Foundation (PMI-EF).,10 Weeks,3-4 hours per week,$25 USD,IDBx,Business & Management,Intermediate,Français,Missing,https://prod-discovery.edx-cdn.org/media/course/image/b96808bd-b863-4bcf-bf8d-9f026b2084f3-3d4e3f9e817f.small.jpeg,39259
https://www.edx.org/course/deep-learning-with-tensorflow,Deep Learning with Tensorflow,"Much of theworld's data is unstructured. Think images, sound, and textual data. Learn how to apply Deep Learning with TensorFlow to this type of data to solve real-world problems.",5 Weeks,2-4 hours per week,$99 USD,IBM,Data Analysis & Statistics,Intermediate,English,Missing,https://prod-discovery.edx-cdn.org/media/course/image/50101caa-3572-4dd7-aa84-01f1d53c8042-e2e6f25d8354.small.jpg,36359
https://www.edx.org/course/effective-communication-for-todays-leader,Effective Communication for Today's Leader,Identify and develop the most important communication skills: assertiveness and empathy.,4 Weeks,5-8 hours per week,$149 USD,TecdeMonterreyX,Business & Management,Intermediate,English,Bachelor's Degree Level,https://prod-discovery.edx-cdn.org/media/course/image/070c8c2d-7d7a-4335-a020-16beedfc7236-5fce383ad57e.small.jpeg,7855
